Item Title,Publication Title,Book Series Title,Journal Volume,Journal Issue,Item DOI,Authors,Publication Year,URL,Content Type
"Simple Management of High Assurance Data in Long-Lived Interdisciplinary Healthcare Research: A Proposal","Leveraging Applications of Formal Methods, Verification and Validation. Specialized Techniques and Applications","","","","10.1007/978-3-662-45231-8_44","Tiziana MargariaBarry D. FloydRodolfo Gonzalez CamargoAnna-Lena LamprechtJohannes NeubauerMarilia Seelaender","2014","http://link.springer.com/chapter/10.1007/978-3-662-45231-8_44","Chapter"
"Interactive Multimedia Tabletops (IMT) for Casual Users","Trends in Practical Applications of Agents and Multiagent Systems","","","","10.1007/978-3-642-12433-4_80","Andoni Beristain IraolaManuel Graña Romay","2010","http://link.springer.com/chapter/10.1007/978-3-642-12433-4_80","Chapter"
"Socially Capable Conversational Tutors Can Be Effective in Collaborative Learning Situations","Intelligent Tutoring Systems","","","","10.1007/978-3-642-13388-6_20","Rohit KumarHua AiJack L. BeuthCarolyn P. Rosé","2010","http://link.springer.com/chapter/10.1007/978-3-642-13388-6_20","Chapter"
"An Aircraft Tooling e-Manufacturing Architecture Based on Mobile Agents","Proceedings of the 6th CIRP-Sponsored International Conference on Digital Enterprise Technology","","","","10.1007/978-3-642-10430-5_93","Yingguang LiJianbang JianHai Li","2010","http://link.springer.com/chapter/10.1007/978-3-642-10430-5_93","Chapter"
"A Service Encapsulation Method in Cloud Simulation Platform","AsiaSim 2012","","","","10.1007/978-3-642-34390-2_49","Wensheng XuLingjun KongNan LiJianzhong Cha","2012","http://link.springer.com/chapter/10.1007/978-3-642-34390-2_49","Chapter"
"Value Encounters – Modeling and Analyzing Co-creation of Value","Software Services for e-Business and e-Society","","","","10.1007/978-3-642-04280-5_5","Hans Weigand","2009","http://link.springer.com/chapter/10.1007/978-3-642-04280-5_5","Chapter"
"Virtual Office, Community, and Computing (VOCC): Designing an Energy Science Hub Collaboration System","Human Centered Design","","","","10.1007/978-3-642-21753-1_48","April A. LewisGilbert G. Weigand","2011","http://link.springer.com/chapter/10.1007/978-3-642-21753-1_48","Chapter"
"TIDE: Lightweight Device Composition for Enhancing Tabletop Environments with Smartphone Applications","Human-Computer Interaction – INTERACT 2013","","","","10.1007/978-3-642-40498-6_13","Léo SicardAurélien TabardJuan David Hincapié-RamosJakob E. Bardram","2013","http://link.springer.com/chapter/10.1007/978-3-642-40498-6_13","Chapter"
"Supply Chain Integration Based on Core Manufacturing Enterprise","Computer and Computing Technologies in Agriculture IV","","","","10.1007/978-3-642-18354-6_3","Wenqin CaoHaiyan Zhu","2011","http://link.springer.com/chapter/10.1007/978-3-642-18354-6_3","Chapter"
"Method of Software Operation Consistency for Tablet Devices by Sound Recognition","Knowledge-Based Software Engineering","","","","10.1007/978-3-319-11854-3_59","Hajime IwataKazuhide Koyama","2014","http://link.springer.com/chapter/10.1007/978-3-319-11854-3_59","Chapter"
"Serious Games for the Therapy of the Posttraumatic Stress Disorder of Children and Adolescents","Virtual and Mixed Reality - Systems and Applications","","","","10.1007/978-3-642-22024-1_6","Rafael RadkowskiWilfried HuckGitta DomikMartin Holtmann","2011","http://link.springer.com/chapter/10.1007/978-3-642-22024-1_6","Chapter"
"Adding Semantic Extension to Wikis for Enhancing Cultural Heritage Applications","Digital Information and Communication Technology and Its Applications","","","","10.1007/978-3-642-22027-2_29","Éric LeclercqMarinette Savonnet","2011","http://link.springer.com/chapter/10.1007/978-3-642-22027-2_29","Chapter"
"Structural Design Based on Performance Applied to Development of a Lattice Wind Tower","Computer-Aided Architectural Design Futures. The Next City - New Technologies and the Future of the Built Environment","","","","10.1007/978-3-662-47386-3_14","Marina BorgesRicardo H. Fakury","2015","http://link.springer.com/chapter/10.1007/978-3-662-47386-3_14","Chapter"
"Research and Application on Virtual Prototying Engineering Grid","Systems Modeling and Simulation","","","","10.1007/978-4-431-49022-7_62","Bo Hu LiXudong ChaiWenhai ZhuBaocun HouGuoqiang ShiPeng WangRunmin Yin","2007","http://link.springer.com/chapter/10.1007/978-4-431-49022-7_62","Chapter"
"A Two-User Framework for Rapid Immersive Full Cycle Product Customization","Virtual and Mixed Reality","","","","10.1007/978-3-642-02771-0_63","Maxim FoursaDavid d’AngeloGerold WescheManfred Bogen","2009","http://link.springer.com/chapter/10.1007/978-3-642-02771-0_63","Chapter"
"A Reference Model for Factory Engineering and Design","Proceedings of the 6th CIRP-Sponsored International Conference on Digital Enterprise Technology","","","","10.1007/978-3-642-10430-5_117","Carmen ConstantinescuEngelbert Westkämper","2010","http://link.springer.com/chapter/10.1007/978-3-642-10430-5_117","Chapter"
"Study on Technology System of Human Factors Engineering (HFE)","Proceedings of the 15th International Conference on Man–Machine–Environment System Engineering","","","","10.1007/978-3-662-48224-7_84","Baozhi WangGuohua JiangZhiqiang TianJunrong LiJialu MaNing HeWei ZhaoWenhao Zhan","2015","http://link.springer.com/chapter/10.1007/978-3-662-48224-7_84","Chapter"
"A Tool to Support PLM Teaching in Universities","Product Lifecycle Management for Society","","","","10.1007/978-3-642-41501-2_51","Joel Sauza BedollaFrancesco RicciJavier Martinez GomezPaolo Chiabert","2013","http://link.springer.com/chapter/10.1007/978-3-642-41501-2_51","Chapter"
"Creating a Repository of Community Memory in a 3D Virtual World: Experiences and Challenges","Research and Advanced Technology for Digital Libraries","","","","10.1007/978-3-642-40501-3_52","Ekaterina Prasolova-FørlandMikhail FominykhLeif Martin Hokstad","2013","http://link.springer.com/chapter/10.1007/978-3-642-40501-3_52","Chapter"
"Handheld AR for Collaborative Edutainment","Advances in Artificial Reality and Tele-Existence","","","","10.1007/11941354_10","Daniel WagnerDieter SchmalstiegMark Billinghurst","2006","http://link.springer.com/chapter/10.1007/11941354_10","Chapter"
"Towards Amplifying Business Process Reuse","Perspectives in Conceptual Modeling","","","","10.1007/11568346_39","Sergiy ZlatkinRoland Kaschek","2005","http://link.springer.com/chapter/10.1007/11568346_39","Chapter"
"Using Narrative Research and Portraiture to Inform Design Research","Human-Computer Interaction – INTERACT 2013","","","","10.1007/978-3-642-40477-1_19","Connie GolsteijnSerena Wright","2013","http://link.springer.com/chapter/10.1007/978-3-642-40477-1_19","Chapter"
"Online Collaboration Support Tools for Blended Project-Based Learning on Embedded Software Development","Intelligent Interactive Multimedia: Systems and Services","","","","10.1007/978-3-642-29934-6_40","Takashi YukawaTomonori IwazakiKeisuke IshidaYuji NishigakiYoshimi FukumuraMakoto YamazakiNaoki HasegawaHajime Miura","2012","http://link.springer.com/chapter/10.1007/978-3-642-29934-6_40","Chapter"
"Negotiation Support in Collaborative Services Design","Technological Innovation for Collective Awareness Systems","","","","10.1007/978-3-642-54734-8_2","Ana Inês OliveiraLuis M. Camarinha-Matos","2014","http://link.springer.com/chapter/10.1007/978-3-642-54734-8_2","Chapter"
"Providing Full Awareness to Distributed Virtual Environments Based on Peer-to-Peer Architectures","Advances in Computer Graphics","","","","10.1007/11784203_29","P. MorilloW. MonchoJ. M. OrduñaJ. Duato","2006","http://link.springer.com/chapter/10.1007/11784203_29","Chapter"
"A Reconfigurable Immersive Workbench and Wall-System for Designing and Training in 3D Environments","Virtual Reality","","","","10.1007/978-3-540-73335-5_50","Jesús GimenoMarcos FernándezPedro MorilloInmaculada ComaManuel Pérez","2007","http://link.springer.com/chapter/10.1007/978-3-540-73335-5_50","Chapter"
"A Service Providing Awareness of Learning Object Evolutions in a Distributed Environment","Times of Convergence. Technologies Across Learning Contexts","","","","10.1007/978-3-540-87605-2_9","Olivier CatteauPhilippe VidalJulien Broisin","2008","http://link.springer.com/chapter/10.1007/978-3-540-87605-2_9","Chapter"
"Design Support Based onto Knowledge to Increase Product Reliability and Allow Optimized Abacus Development","Advances in Production Management Systems. Competitive Manufacturing for Innovative Products and Services","","","","10.1007/978-3-642-40361-3_26","Jérémy BoxbergerDaniel SchlegelNahdir LebaalSamuel Gomes","2013","http://link.springer.com/chapter/10.1007/978-3-642-40361-3_26","Chapter"
"Management of Associations within Digital Mock-Ups for Improved Collaboration","Product Lifecycle Management. Towards Knowledge-Rich Enterprises","","","","10.1007/978-3-642-35758-9_37","Borhen LouhichiLouis Rivest","2012","http://link.springer.com/chapter/10.1007/978-3-642-35758-9_37","Chapter"
"Exerted Enterprise Computing: From Protocol-Oriented Networking to Exertion-Oriented Networking","On the Move to Meaningful Internet Systems: OTM 2010 Workshops","","","","10.1007/978-3-642-16961-8_36","Michael Sobolewski","2010","http://link.springer.com/chapter/10.1007/978-3-642-16961-8_36","Chapter"
"A Pilot Evaluation of a Therapeutic Game Applied to Small Animal Phobia Treatment","Serious Games Development and Applications","","","","10.1007/978-3-319-11623-5_2","Maja WrzesienMariano AlcañizCristina BotellaJean-Marie BurkhardtJuana Breton LopezAlejandro Rodriguez Ortega","2014","http://link.springer.com/chapter/10.1007/978-3-319-11623-5_2","Chapter"
"An Autoethnographic Study of HCI Effort Estimation in Outsourced Software Development","Human-Centered Software Engineering","","","","10.1007/978-3-662-44811-3_2","Shalaka DigheAnirudha Joshi","2014","http://link.springer.com/chapter/10.1007/978-3-662-44811-3_2","Chapter"
"Challenges for Integrated Design and Delivery Teams in AEC","Product Lifecycle Management for Society","","","","10.1007/978-3-642-41501-2_63","Vishal Singh","2013","http://link.springer.com/chapter/10.1007/978-3-642-41501-2_63","Chapter"
"A Structural Prototype for Planning and Controlling a Manufacturing System","New Contributions in Information Systems and Technologies","","","","10.1007/978-3-319-16486-1_8","Paulo Enes Silveira","2015","http://link.springer.com/chapter/10.1007/978-3-319-16486-1_8","Chapter"
"Towards a Flexible Assessment of Climate Impacts: The Example of Agile Workflows for the ci:grasp Platform","Leveraging Applications of Formal Methods, Verification and Validation. Specialized Techniques and Applications","","","","10.1007/978-3-662-45231-8_33","Samih Al-AreqiSteffen KriewaldAnna-Lena LamprechtDominik ReusserMarkus WrobelTiziana Margaria","2014","http://link.springer.com/chapter/10.1007/978-3-662-45231-8_33","Chapter"
"The Development of a Scale to Assess Creative Collaboration via Online Tools","New Horizons in Web Based Learning","","","","10.1007/978-3-662-43454-3_33","Jocelyn WishartSarah Eagle","2014","http://link.springer.com/chapter/10.1007/978-3-662-43454-3_33","Chapter"
"Collaborative Augmented Reality: Multi-user Interaction in Urban Simulation","Visual Informatics: Bridging Research and Practice","","","","10.1007/978-3-642-05036-7_36","Ajune Wanis IsmailMohd. Shahrizal Sunar","2009","http://link.springer.com/chapter/10.1007/978-3-642-05036-7_36","Chapter"
"Immediacy in User Interfaces: An Activity Theoretical Approach","Human-Computer Interaction. Theories, Methods, and Tools","","","","10.1007/978-3-319-07233-3_2","Sturla Bakke","2014","http://link.springer.com/chapter/10.1007/978-3-319-07233-3_2","Chapter"
"Alignment of Ontology Design Patterns: Class As Property Value, Value Partition and Normalisation","On the Move to Meaningful Internet Systems: OTM 2012","","","","10.1007/978-3-642-33615-7_16","Bene Rodriguez-CastroMouzhi GeMartin Hepp","2012","http://link.springer.com/chapter/10.1007/978-3-642-33615-7_16","Chapter"
"Evaluating User Experience for Interactive Television: Towards the Development of a Domain-Specific User Experience Questionnaire","Human-Computer Interaction – INTERACT 2013","","","","10.1007/978-3-642-40480-1_45","Regina BernhauptMichael Pirker","2013","http://link.springer.com/chapter/10.1007/978-3-642-40480-1_45","Chapter"
"A Knowledge Management Approach through Product Lifecycle Management Implementation: An Industrial Case Study","Product Lifecycle Management for Society","","","","10.1007/978-3-642-41501-2_28","Ricardo Mejía-GutiérrezCarolina MarroquínJuan David Giraldo-Gomez","2013","http://link.springer.com/chapter/10.1007/978-3-642-41501-2_28","Chapter"
"Enhancing Trust in SOA Based Collaborative Environments","Systems and Virtualization Management. Standards and the Cloud","","","","10.1007/978-3-642-14944-3_11","Latifa BoursasMohamed BourimiWolfgang HommelDogan Kesdogan","2010","http://link.springer.com/chapter/10.1007/978-3-642-14944-3_11","Chapter"
"Reaching Out in the Mind's Space","Design Computing and Cognition '08","","","","10.1007/978-1-4020-8728-8_17","Uday AthavankarP. BokilK. GuruprasadR. PatsuteS. Sharma","2008","http://link.springer.com/chapter/10.1007/978-1-4020-8728-8_17","Chapter"
"Using Cultural Probes to Inform the Design of Assistive Technologies","Human-Computer Interaction. Theories, Methods, and Tools","","","","10.1007/978-3-319-07233-3_4","Michael BrownAllen TsaiSharon BaurleyTherese KoppeGlyn LawsonJennifer MartinTim CoughlanMeretta ElliottStephen GreenUnna Arunachalam","2014","http://link.springer.com/chapter/10.1007/978-3-319-07233-3_4","Chapter"
"Semantic Relationship Based Knowledge Management and Reuse in Collaborative Product Development","Product Lifecycle Management. Towards Knowledge-Rich Enterprises","","","","10.1007/978-3-642-35758-9_1","Ibrahim AssourokoGuillaume DucellierBenoît EynardPhilippe Boutinaud","2012","http://link.springer.com/chapter/10.1007/978-3-642-35758-9_1","Chapter"
"Blended Interaction Design: A Spatial Workspace Supporting HCI and Design Practice","Human-Computer Interaction – INTERACT 2009","","","","10.1007/978-3-642-03658-3_92","Florian Geyer","2009","http://link.springer.com/chapter/10.1007/978-3-642-03658-3_92","Chapter"
"Securing Data Quality along the Supply Chain","Product Lifecycle Management for Society","","","","10.1007/978-3-642-41501-2_69","Sergej BondarChristoph RuppertJosip Stjepandic","2013","http://link.springer.com/chapter/10.1007/978-3-642-41501-2_69","Chapter"
"Proposing Formal Notation for Modeling Collaborative Processes Extending HAMSTERS Notation","New Perspectives in Information Systems and Technologies, Volume 1","","","","10.1007/978-3-319-05951-8_25","Andrés SolanoToni GranollersCésar A. CollazosCristian Rusu","2014","http://link.springer.com/chapter/10.1007/978-3-319-05951-8_25","Chapter"
"Internet Server Controller Based Intelligent Maintenance System for Products","Applied Soft Computing Technologies: The Challenge of Complexity","","","","10.1007/3-540-31662-0_60","Chengliang LiuXuan F ZhaYubin MiaoJay Lee","2006","http://link.springer.com/chapter/10.1007/3-540-31662-0_60","Chapter"
"Semantic Enrichment by Non-experts: Usability of Manual Annotation Tools","The Semantic Web – ISWC 2012","","","","10.1007/978-3-642-35176-1_11","Annika HinzeRalf HeeseMarkus Luczak-RöschAdrian Paschke","2012","http://link.springer.com/chapter/10.1007/978-3-642-35176-1_11","Chapter"
"An Interactive Genetic Algorithm for the Unequal Area Facility Layout Problem","Soft Computing Models in Industrial and Environmental Applications, 6th International Conference SOCO 2011","","","","10.1007/978-3-642-19644-7_27","Laura Garcia HernandezLorenzo Salas MoreraAntonio Arauzo Azofra","2011","http://link.springer.com/chapter/10.1007/978-3-642-19644-7_27","Chapter"
"Enabling the Collaborative Definition of DSMLs","Advanced Information Systems Engineering","","","","10.1007/978-3-642-38709-8_18","Javier Luis Cánovas IzquierdoJordi Cabot","2013","http://link.springer.com/chapter/10.1007/978-3-642-38709-8_18","Chapter"
"Assembly Path Planning Method Based on Lightweight Model","Proceedings of the 6th CIRP-Sponsored International Conference on Digital Enterprise Technology","","","","10.1007/978-3-642-10430-5_3","Junhao GengXiaoliang JiaXitian TianZhouyang Li","2010","http://link.springer.com/chapter/10.1007/978-3-642-10430-5_3","Chapter"
"Towards Model-Based System Engineering for Simulation-Based Design in Product Data Management Systems","Product Lifecycle Management. Towards Knowledge-Rich Enterprises","","","","10.1007/978-3-642-35758-9_55","Thomas VosgienThomas Nguyen VanMarija JankovicBenoît EynardJean-Claude Bocquet","2012","http://link.springer.com/chapter/10.1007/978-3-642-35758-9_55","Chapter"
"Next Generation Tele-Teaching: Latest Recording Technology, User Engagement and Automatic Metadata Retrieval","Human Factors in Computing and Informatics","","","","10.1007/978-3-642-39062-3_25","Franka GrünewaldHaojin YangElnaz MazandaraniMatthias BauerChristoph Meinel","2013","http://link.springer.com/chapter/10.1007/978-3-642-39062-3_25","Chapter"
"Research Issues on Customer-Oriented and Eco-friendly Networks for Healthy Fashionable Goods","Balanced Automation Systems for Future Manufacturing Networks","","","","10.1007/978-3-642-14341-0_5","Rosanna FornasieroAndrea ChiodiEmanuele CarpanzanoLuis Carneiro","2010","http://link.springer.com/chapter/10.1007/978-3-642-14341-0_5","Chapter"
"Multiplying Architectural Layouts and 3D Forms: Interplay of Necessity and Contingency in Architectural Modeling","Global Design and Local Materialization","","","","10.1007/978-3-642-38974-0_32","Hao Hua","2013","http://link.springer.com/chapter/10.1007/978-3-642-38974-0_32","Chapter"
"Research on Product Family Modeling Method for Design Resource Reuse","Computing and Intelligent Systems","","","","10.1007/978-3-642-24010-2_46","Shouming HouLijuan HeHualong XieYongxian Liu","2011","http://link.springer.com/chapter/10.1007/978-3-642-24010-2_46","Chapter"
"Web-Based Portal for Sharing Information through CAD/PLM Software during the Eco-product Development Process","Product Lifecycle Management for Society","","","","10.1007/978-3-642-41501-2_38","Idai Mendy MombeshoraElies Dekoninck","2013","http://link.springer.com/chapter/10.1007/978-3-642-41501-2_38","Chapter"
"A Reverse Engineering Method for DMU Maturity Management: Use of a Functional Reeb Graph","Product Lifecycle Management for Society","","","","10.1007/978-3-642-41501-2_42","Guillaume HerlemGuillaume DucellierPierre-Antoine AdragnaAlexandre DuruptSébastien Remy","2013","http://link.springer.com/chapter/10.1007/978-3-642-41501-2_42","Chapter"
"Towards a Modular Network-Distributed Mixed-Reality Learning Space System","Advances in Visual Computing","","","","10.1007/11919629_64","Timothy J. RogersBedřich BenešGary R. Bertoline","2006","http://link.springer.com/chapter/10.1007/11919629_64","Chapter"
"SmartVolumes - Adaptive Voronoi Power Diagramming for Real-Time Volumetric Design Exploration","Virtual Systems and Multimedia","","","","10.1007/978-3-540-78566-8_12","Christian Friedrich","2008","http://link.springer.com/chapter/10.1007/978-3-540-78566-8_12","Chapter"
"Agent-Based Distributed Collaborative Monitoring and Maintenance in Manufacturing","Emerging Solutions for Future Manufacturing Systems","","","","10.1007/0-387-22829-2_14","Chun WangHamada GhenniwaWeiming ShenYue Zhang","2005","http://link.springer.com/chapter/10.1007/0-387-22829-2_14","Chapter"
"Table-Top Interface Using Fingernail Images and Real Object Recognition","Ambient Intelligence","","","","10.1007/978-3-642-25167-2_3","Kenta HaraNoriko TakemuraYoshio IwaiKosuke Sato","2011","http://link.springer.com/chapter/10.1007/978-3-642-25167-2_3","Chapter"
"A Design Pattern Library for Mutual Understanding and Cooperation in Serious Game Design","Intelligent Tutoring Systems","","","","10.1007/978-3-642-30950-2_18","Bertrand MarneJohn WisdomBenjamin Huynh-Kim-BangJean-Marc Labat","2012","http://link.springer.com/chapter/10.1007/978-3-642-30950-2_18","Chapter"
"LabTablet: Semantic Metadata Collection on a Multi-domain Laboratory Notebook","Metadata and Semantics Research","","","","10.1007/978-3-319-13674-5_19","Ricardo Carvalho AmorimJoão Aguiar CastroJoão Rocha da SilvaCristina Ribeiro","2014","http://link.springer.com/chapter/10.1007/978-3-319-13674-5_19","Chapter"
"A Design Science Approach to Youth Care through Online Simulation Gaming","Frontiers in Gaming Simulation","","","","10.1007/978-3-319-04954-0_20","Kees J. M. van Haaster","2014","http://link.springer.com/chapter/10.1007/978-3-319-04954-0_20","Chapter"
"Bilingual Reading Experiences: What They Could Be and How to Design for Them","Human-Computer Interaction – INTERACT 2015","","","","10.1007/978-3-319-22701-6_39","Clément PilliasPierre Cubaud","2015","http://link.springer.com/chapter/10.1007/978-3-319-22701-6_39","Chapter"
"A Sustainability Lifecycle Assessment of Products and Services for the Extended Enterprise Evolution","Product Lifecycle Management for Society","","","","10.1007/978-3-642-41501-2_11","Margherita PeruzziniMichele GermaniEugenia Marilungo","2013","http://link.springer.com/chapter/10.1007/978-3-642-41501-2_11","Chapter"
"Assembly Features Utilization to Support Production System Adaptation","Technological Innovation for Collective Awareness Systems","","","","10.1007/978-3-642-54734-8_10","Baha HasanMauro OnoriJan Wikander","2014","http://link.springer.com/chapter/10.1007/978-3-642-54734-8_10","Chapter"
"Secondary Developments Based on BIM Virtual Technology","Information Computing and Applications","","","","10.1007/978-3-642-53703-5_18","Siwen Bai","2013","http://link.springer.com/chapter/10.1007/978-3-642-53703-5_18","Chapter"
"Product Documentation Management Through REST-Based Web Service","Computational Intelligence and Decision Making","","","","10.1007/978-94-007-4722-7_17","Filipe RochaMaria Leonilde R. VarelaSílvio Carmo-Silva","2013","http://link.springer.com/chapter/10.1007/978-94-007-4722-7_17","Chapter"
"Analytical Target Cascading for Optimal Configuration of Production Service Systems","Proceedings of the 6th CIRP-Sponsored International Conference on Digital Enterprise Technology","","","","10.1007/978-3-642-10430-5_122","T. QuGeorge Q. HuangY. F. ZhangH. D. Yang","2010","http://link.springer.com/chapter/10.1007/978-3-642-10430-5_122","Chapter"
"E-portfolio Development Through Activity Theory in Action Research","Knowledge Management in Organizations","","","","10.1007/978-3-319-08618-7_30","Wardah Zainal AbidinLorna UdenRose Alinda Alias","2014","http://link.springer.com/chapter/10.1007/978-3-319-08618-7_30","Chapter"
"Children’s Interactions in an Asynchronous Video Mediated Communication Environment","Human-Computer Interaction – INTERACT 2011","","","","10.1007/978-3-642-23774-4_18","Michail N. GiannakosKonstantinos ChorianopoulosPaul JohnsKori InkpenHonglu Du","2011","http://link.springer.com/chapter/10.1007/978-3-642-23774-4_18","Chapter"
"Learning Design Studio: Educational Practice as Design Inquiry of Learning","Scaling up Learning for Sustained Impact","","","","10.1007/978-3-642-40814-4_19","Yishay MorOrit Mogilevsky","2013","http://link.springer.com/chapter/10.1007/978-3-642-40814-4_19","Chapter"
"Towards Design Engineering of Ubiquitous Information Systems","Design Science Research in Information Systems. Advances in Theory and Practice","","","","10.1007/978-3-642-29863-9_16","Wolfgang MaassSabine Janzen","2012","http://link.springer.com/chapter/10.1007/978-3-642-29863-9_16","Chapter"
"Analysis of Requirements for Collaborative Scientific Experimentation Environments","Emerging Solutions for Future Manufacturing Systems","","","","10.1007/0-387-22829-2_26","Ersin C. KaletasHamideh AfsarmaneshL. O. Hertzberger","2005","http://link.springer.com/chapter/10.1007/0-387-22829-2_26","Chapter"
"Flexible Analysis of User Actions in Heterogeneous Distributed Learning Environments","Times of Convergence. Technologies Across Learning Contexts","","","","10.1007/978-3-540-87605-2_8","Lars BollenAdam GiemzaH. Ulrich Hoppe","2008","http://link.springer.com/chapter/10.1007/978-3-540-87605-2_8","Chapter"
"A Novel Collaborative Planning Approach for Digital Manufacturing","Proceedings of the 6th CIRP-Sponsored International Conference on Digital Enterprise Technology","","","","10.1007/978-3-642-10430-5_73","Lihui Wang","2010","http://link.springer.com/chapter/10.1007/978-3-642-10430-5_73","Chapter"
"Collaborative E-Engineering Environments to Support Integrated Product Development","Emerging Solutions for Future Manufacturing Systems","","","","10.1007/0-387-22829-2_28","Ricardo MejíaJoaquín AcaHoracio AhuettArturo Molina","2005","http://link.springer.com/chapter/10.1007/0-387-22829-2_28","Chapter"
"Virtual Reality Based GIS Analysis Platform","Neural Information Processing","","","","10.1007/978-3-319-26535-3_73","Weixi WangZhihan LvXiaoming LiWeiping XuBaoyun ZhangXiaolei Zhang","2015","http://link.springer.com/chapter/10.1007/978-3-319-26535-3_73","Chapter"
"Modeling and Simulation Tool for Sustainable MC Supply Chain Design and Assessment","Advances in Production Management Systems. Competitive Manufacturing for Innovative Products and Services","","","","10.1007/978-3-642-40352-1_43","Paolo PedrazzoliMarino AlgeAndrea BettoniLuca Canetta","2013","http://link.springer.com/chapter/10.1007/978-3-642-40352-1_43","Chapter"
"Survey on Collaborative AR for Multi-user in Urban Studies and Planning","Learning by Playing. Game-based Education System Design and Development","","","","10.1007/978-3-642-03364-3_53","Ajune Wanis IsmailMohd Shahrizal Sunar","2009","http://link.springer.com/chapter/10.1007/978-3-642-03364-3_53","Chapter"
