Item Title,Publication Title,Book Series Title,Journal Volume,Journal Issue,Item DOI,Authors,Publication Year,URL,Content Type
"Integrating Competence Management into a Coupled Project-System Design Management","Advances in Production Management Systems. Competitive Manufacturing for Innovative Products and Services","","","","10.1007/978-3-642-40352-1_79","Arz WehbeChristophe MerloVéronique Pilnière","2013","http://link.springer.com/chapter/10.1007/978-3-642-40352-1_79","Chapter"
"Multidisciplinary AEC Education Utilising BIM / PLIM Tools and Processes","Product Lifecycle Management for Society","","","","10.1007/978-3-642-41501-2_65","Jennifer A. MacdonaldMarko Granroth","2013","http://link.springer.com/chapter/10.1007/978-3-642-41501-2_65","Chapter"
"Assessing the “Quality of Collaboration” in Technology-Mediated Design Situations with Several Dimensions","Human-Computer Interaction – INTERACT 2009","","","","10.1007/978-3-642-03658-3_20","Jean-Marie BurkhardtFrançoise DétienneAnne-Marie HébertLaurence Perron","2009","http://link.springer.com/chapter/10.1007/978-3-642-03658-3_20","Chapter"
"Experiential Collaborative Learning and Preferential Thinking","Technology Enhanced Learning. Quality of Teaching and Educational Reform","","","","10.1007/978-3-642-13166-0_33","Antonio P. VolpentestaSalvatore AmmiratoFrancesco Sofo","2010","http://link.springer.com/chapter/10.1007/978-3-642-13166-0_33","Chapter"
"Applying Augmented Reality to the Concept Development Stage of the Total Design Methodology","Virtual, Augmented and Mixed Reality. Applications of Virtual and Augmented Reality","","","","10.1007/978-3-319-07464-1_38","Gordon M. MairAndrew RobinsonJohn Storr","2014","http://link.springer.com/chapter/10.1007/978-3-319-07464-1_38","Chapter"
"A Framework for Evaluating Collaborative Product Representations in Product Lifecycle Workflows","Product Lifecycle Management. Towards Knowledge-Rich Enterprises","","","","10.1007/978-3-642-35758-9_38","Nathan HartmanPhil RoscheKevin Fischer","2012","http://link.springer.com/chapter/10.1007/978-3-642-35758-9_38","Chapter"
"A Fuzzy Quantitative Integrated Metric Model for CMMI Appraisal","Hybrid Artificial Intelligence Systems","","","","10.1007/978-3-642-02319-4_26","Ching-Hsue ChengJing-Rong ChangChen-Yi KuoShu-Ying Liao","2009","http://link.springer.com/chapter/10.1007/978-3-642-02319-4_26","Chapter"
"EvoSpace-Interactive: A Framework to Develop Distributed Collaborative-Interactive Evolutionary Algorithms for Artistic Design","Evolutionary and Biologically Inspired Music, Sound, Art and Design","","","","10.1007/978-3-642-36955-1_11","Mario García-ValdezLeonardo TrujilloFrancisco Fernández de VegaJuan Julián Merelo GuervósGustavo Olague","2013","http://link.springer.com/chapter/10.1007/978-3-642-36955-1_11","Chapter"
"Aesthetic Intelligence: The Role of Design in Ambient Intelligence","Ambient Intelligence","","","","10.1007/978-3-642-34898-3_41","Carsten RöckerKai KasugaiDaniela PleweTakashi KiriyamaArtur Lugmayr","2012","http://link.springer.com/chapter/10.1007/978-3-642-34898-3_41","Chapter"
"Optimization of Human Perception on Virtual Garments by Modeling the Relation between Fabric Properties and Sensory Descriptors Using Intelligent Techniques","Information Processing and Management of Uncertainty in Knowledge-Based Systems","","","","10.1007/978-3-319-08855-6_61","Xiaon ChenXianyi ZengLudovic KoehlXuyuan TaoJulie Boulenguez-Phippen","2014","http://link.springer.com/chapter/10.1007/978-3-319-08855-6_61","Chapter"
"Infrastructure Development in the Knowledge City","Intelligent Computing in Engineering and Architecture","","","","10.1007/11888598_19","Tamer E. El-Diraby","2006","http://link.springer.com/chapter/10.1007/11888598_19","Chapter"
"A View of Future Technologies and Challenges for the Automation of Localisation Processes: Visions and Scenarios","Convergence and Hybrid Information Technology","","","","10.1007/978-3-642-24106-2_48","Lamine AouadIan R. O’KeeffeJ. J. CollinsAsanka WasalaNaoto NishioAram MoreraLucia MoradoLorcan RyanRajat GuptaReinhard Schaler","2011","http://link.springer.com/chapter/10.1007/978-3-642-24106-2_48","Chapter"
"Nonspeech Sound Design for a Hierarchical Information System","Human Centered Design","","","","10.1007/978-3-642-21753-1_52","Rafa AbsarCatherine Guastavino","2011","http://link.springer.com/chapter/10.1007/978-3-642-21753-1_52","Chapter"
"Designing a Free Style, Indirect, and Interactive Storytelling Application for People with Aphasia","Human-Computer Interaction – INTERACT 2007","","","","10.1007/978-3-540-74796-3_21","Elke DaemenPavan DadlaniJia DuYing LiPinar Erik-PakerJean-Bernard MartensBoris de Ruyter","2007","http://link.springer.com/chapter/10.1007/978-3-540-74796-3_21","Chapter"
"A Systematic Review of Sustainability and Aspects of Human-Computer Interaction","Human-Computer Interaction. Applications and Services","","","","10.1007/978-3-319-07227-2_71","Vânia Paula de Almeida NerisKamila Rios da Hora RodriguesRenata Firmino Lima","2014","http://link.springer.com/chapter/10.1007/978-3-319-07227-2_71","Chapter"
"Participatory Human-Centered Design: User Involvement and Design Cross-Fertilization","Human Centered Design","","","","10.1007/978-3-642-02806-9_96","Guy A. BoyNadja Riedel","2009","http://link.springer.com/chapter/10.1007/978-3-642-02806-9_96","Chapter"
"Three User-Driven Innovation Methods for Co-creating Cloud Services","Human-Computer Interaction – INTERACT 2011","","","","10.1007/978-3-642-23768-3_6","Ting-Ray ChangEija Kaasinen","2011","http://link.springer.com/chapter/10.1007/978-3-642-23768-3_6","Chapter"
"Towards an Engaging Mobile Food Record for Teenagers","New Trends in Image Analysis and Processing -- ICIAP 2015 Workshops","","","","10.1007/978-3-319-23222-5_51","Maurizio CaonStefano CarrinoFederica PrinelliValentina CiociolaFulvio AdorniClaudio LafortunaSarah TabozziJosé SerranoLaura CondonOmar Abou KhaledElena Mugellini","2015","http://link.springer.com/chapter/10.1007/978-3-319-23222-5_51","Chapter"
"Prototyping TV and Tablet Facebook Interfaces for Older Adults","Human-Computer Interaction – INTERACT 2015","","","","10.1007/978-3-319-22701-6_9","José CoelhoFábio RitoNuno LuzCarlos Duarte","2015","http://link.springer.com/chapter/10.1007/978-3-319-22701-6_9","Chapter"
"Participatory Game Design for the INTERACCT Serious Game for Health","Serious Games","","","","10.1007/978-3-319-19126-3_2","Fares KayaliKonrad PetersJens KuczwaraAndrea ReithoferDaniel MartinekRebecca WölfleRuth Mateus-BerrZsuzsanna LehnerMarisa SilbernaglManuel SprungAnita LawitschkaHelmut Hlavacs","2015","http://link.springer.com/chapter/10.1007/978-3-319-19126-3_2","Chapter"
"Towards a Context Oriented Approach to Ethical Evaluation of Interactive Technologies","Human-Computer Interaction – INTERACT 2011","","","","10.1007/978-3-642-23768-3_99","Sandra Burri Gram-HansenHenrik SchärfeJens Vilhelm Dinesen","2011","http://link.springer.com/chapter/10.1007/978-3-642-23768-3_99","Chapter"
"People in Smart Buildings: Daily Practices in Automated Areas","Smart Cities, Green Technologies, and Intelligent Transport Systems","","","","10.1007/978-3-319-27753-0_6","A. Coulbaut-LazzariniG. Bailly","2015","http://link.springer.com/chapter/10.1007/978-3-319-27753-0_6","Chapter"
"Designing a Safer Interactive Healthcare System - The Impact of Authentic User Participation","Human-Computer Interaction – INTERACT 2009","","","","10.1007/978-3-642-03658-3_77","Kathryn L. WentPeter GregorIan W. Ricketts","2009","http://link.springer.com/chapter/10.1007/978-3-642-03658-3_77","Chapter"
"Aspects of Human-Centred Design in HCI with Older Adults: Experiences from the Field","Human-Centered Software Engineering","","","","10.1007/978-3-662-44811-3_14","Ana Correia de BarrosSílvia RêgoJoão Antunes","2014","http://link.springer.com/chapter/10.1007/978-3-662-44811-3_14","Chapter"
"Theoretical Framework of the iCampFolio – New Approach to Comparison and Selection of Systems and Tools for Learning Purposes","Creating New Learning Experiences on a Global Scale","","","","10.1007/978-3-540-75195-3_25","Terje VäljatagaKai PataMart LaanpereMauri Kaipainen","2007","http://link.springer.com/chapter/10.1007/978-3-540-75195-3_25","Chapter"
"eAssessment for 21st Century Learning and Skills","21st Century Learning for 21st Century Skills","","","","10.1007/978-3-642-33263-0_23","Christine RedeckerYves PunieAnusca Ferrari","2012","http://link.springer.com/chapter/10.1007/978-3-642-33263-0_23","Chapter"
"Empathic Robotic Tutors for Personalised Learning: A Multidisciplinary Approach","Social Robotics","","","","10.1007/978-3-319-25554-5_29","Aidan JonesDennis KüsterChristina Anne BasedowPatrıcia Alves-OliveiraSofia SerholtHelen HastieLee J. CorriganWolmet BarendregtArvid KappasAna PaivaGinevra Castellano","2015","http://link.springer.com/chapter/10.1007/978-3-319-25554-5_29","Chapter"
"A 21st Century Ethical Debate: Pursuing Perspectives on Ambient Intelligence","The Information Society: Emerging Landscapes","","","","10.1007/0-387-31168-8_18","Penny DuquenoyDiane Whitehouse","2006","http://link.springer.com/chapter/10.1007/0-387-31168-8_18","Chapter"
"The Co-Creation Machine: Managing Co-Creative Processes for the Crowd","Advancing Democracy, Government and Governance","","","","10.1007/978-3-642-32701-8_15","John DebenhamSimeon Simoff","2012","http://link.springer.com/chapter/10.1007/978-3-642-32701-8_15","Chapter"
"A Collaborative Agent Architecture with Human-Agent Communication Model","Cognitive Agents for Virtual Environments","","","","10.1007/978-3-642-36444-0_5","Nader HannaDeborah Richards","2013","http://link.springer.com/chapter/10.1007/978-3-642-36444-0_5","Chapter"
"Working with Users to Ensure Quality of Innovative Software Product despite Uncertainties","Intelligent Information and Database Systems","","","","10.1007/978-3-642-20039-7_34","Barbara Begier","2011","http://link.springer.com/chapter/10.1007/978-3-642-20039-7_34","Chapter"
"Misunderstandings in Global Virtual Engineering Teams: Definitions, Causes, and Guidelines for Knowledge Sharing and Interaction","Methods and Tools for Effective Knowledge Life-Cycle-Management","","","","10.1007/978-3-540-78431-9_8","Myriam LewkowiczFons WijnhovenAnca Draghici","2008","http://link.springer.com/chapter/10.1007/978-3-540-78431-9_8","Chapter"
"Visualization of Small World Networks Using Similarity Matrices","Big Data Analytics","","","","10.1007/978-3-319-03689-2_10","Saima ParveenJaya Sreevalsan-Nair","2013","http://link.springer.com/chapter/10.1007/978-3-319-03689-2_10","Chapter"
"Coordination, Cooperation and Conflict Resolution in Multi-Agent Systems","Innovations and Advanced Techniques in Computer and Information Sciences and Engineering","","","","10.1007/978-1-4020-6268-1_87","W. AlshabiS. RamaswamyM. ItmiH. Abdulrab","2007","http://link.springer.com/chapter/10.1007/978-1-4020-6268-1_87","Chapter"
"Cooperative Building of Multiple Points-of-View Topic Maps with Hypertopic","Scaling Topic Maps","","","","10.1007/978-3-540-70874-2_15","L’Hédi ZaherJean-Pierre CahierClaude Guittard","2008","http://link.springer.com/chapter/10.1007/978-3-540-70874-2_15","Chapter"
"A Cooperative Personal Agenda in a Collaborative Team Environment","Cooperative Design, Visualization, and Engineering","","","","10.1007/978-3-642-04265-2_28","Gabriela SoaresRosaldo RossettiNuno FloresAdemar AguiarHugo Ferreira","2009","http://link.springer.com/chapter/10.1007/978-3-642-04265-2_28","Chapter"
"Future Shape Modelling Scenarios","Future Vision and Trends on Shapes, Geometry and Algebra","","","","10.1007/978-1-4471-6461-6_1","Raffaele De AmicisGiuseppe ContiAndré Stork","2014","http://link.springer.com/chapter/10.1007/978-1-4471-6461-6_1","Chapter"
"HLA Based ASP Platform and Its Federation Integration for Collaborative VPD on INTERNET","Systems Modeling and Simulation","","","","10.1007/978-4-431-49022-7_4","Tianyuan XiaoLingxuan ZhangWenhui FanCe LiangYu Lin","2007","http://link.springer.com/chapter/10.1007/978-4-431-49022-7_4","Chapter"
"A Model of Creative Design Using Collaborative Interactive Genetic Algorithms","Design Computing and Cognition '08","","","","10.1007/978-1-4020-8728-8_21","Amit BanerjeeJuan C. QuirozSushil J. Louis","2008","http://link.springer.com/chapter/10.1007/978-1-4020-8728-8_21","Chapter"
"Development of Product Design Models Using Fuzzy Regression Based Genetic Programming","Computational Intelligence Techniques for New Product Design","","","","10.1007/978-3-642-27476-3_6","Kit Yan ChanC. K. KwongTharam S. Dillon","2012","http://link.springer.com/chapter/10.1007/978-3-642-27476-3_6","Chapter"
"New Trends of Visualization in Smart Production Control Systems","Holonic and Multi-Agent Systems for Manufacturing","","","","10.1007/978-3-642-23181-0_7","Pavel VrbaPetr KaderaVáclav JirkovskýMarek ObitkoVladimír Mařík","2011","http://link.springer.com/chapter/10.1007/978-3-642-23181-0_7","Chapter"
"Can Young People with Autism Spectrum Disorder Benefit From an Open Learner Model?","Artificial Intelligence in Education","","","","10.1007/978-3-319-19773-9_69","Beate GrawemeyerHilary JohnsonMark Brosnan","2015","http://link.springer.com/chapter/10.1007/978-3-319-19773-9_69","Chapter"
"Interactive Techniques","Research in Interactive Design","","","","10.1007/978-2-287-48370-7_5","","2006","http://link.springer.com/chapter/10.1007/978-2-287-48370-7_5","Chapter"
"A Multi-Agent Approach for Engineering Design Knowledge Modelling","Knowlege-Based and Intelligent Information and Engineering Systems","","","","10.1007/978-3-642-23863-5_61","Ricardo Mejía-GutiérrezAlejandro Cálad-ÁlvarezSantiago Ruiz-Arenas","2011","http://link.springer.com/chapter/10.1007/978-3-642-23863-5_61","Chapter"
"Interaction Mechanism for Language Learning for Elderly People through Mobile Devices","Highlights in Practical Applications of Agents and Multiagent Systems","","","","10.1007/978-3-642-19917-2_40","Antonia MacarroEmma VillafainaAna María PintoJavier Bajo","2011","http://link.springer.com/chapter/10.1007/978-3-642-19917-2_40","Chapter"
"Fair Partnerships – Working with NGOs","Human-Computer Interaction – INTERACT 2009","","","","10.1007/978-3-642-03655-2_77","Shikoh GitauGary Marsden","2009","http://link.springer.com/chapter/10.1007/978-3-642-03655-2_77","Chapter"
"The SenseMS: Enriching the SMS Experience for Teens by Non-verbal Means","Human-Computer Interaction - INTERACT 2005","","","","10.1007/11555261_80","Alia K. AminBram KerstenOlga A. KulykElly PelgrimJimmy WangPanos Markopoulos","2005","http://link.springer.com/chapter/10.1007/11555261_80","Chapter"
"Divided by a common acronym: On the fragmentation of CSCW","ECSCW 2009","","","","10.1007/978-1-84882-854-4_14","Kjeld Schmidt","2009","http://link.springer.com/chapter/10.1007/978-1-84882-854-4_14","Chapter"
"A Useful Visualization Technique: A Literature Review for Augmented Reality and its Application, limitation & future direction","Visual Information Communication","","","","10.1007/978-1-4419-0312-9_21","Donggang YuJesse Sheng JinSuhuai LuoWei LaiQingming Huang","2010","http://link.springer.com/chapter/10.1007/978-1-4419-0312-9_21","Chapter"
"Rough Sets Methods for Working with Uncertainty","Cooperative Design, Visualization, and Engineering","","","","10.1007/978-3-642-32609-7_14","Sylvia Encheva","2012","http://link.springer.com/chapter/10.1007/978-3-642-32609-7_14","Chapter"
"Top-Down Definition of Design Spaces Based on Skeleton Modelling","Advances in Production Management Systems. Innovative and Knowledge-Based Production Management in a Global-Local World","","","","10.1007/978-3-662-44739-0_31","Nicolas PetrazollerFrédéric DemolySamuel Gomes","2014","http://link.springer.com/chapter/10.1007/978-3-662-44739-0_31","Chapter"
"Axiomatic Design Using Ontology Modeling for Interoperability in Small Agriculture Machinery Product Development","Knowledge Enterprise: Intelligent Strategies in Product Design, Manufacturing, and Management","","","","10.1007/0-387-34403-9_24","Jiandong JiangFang XuXinrong ZhenXian ZhangYangyu WangLibin Zhang","2006","http://link.springer.com/chapter/10.1007/0-387-34403-9_24","Chapter"
"Cased-Based Reasoning Based on Extension Theory for Conflict Resolution in Cooperative Design","Cooperative Design, Visualization, and Engineering","","","","10.1007/978-3-642-32609-7_18","Yanwei ZhaoHuan WangHuanhuan HongJian Chen","2012","http://link.springer.com/chapter/10.1007/978-3-642-32609-7_18","Chapter"
"Specification of an Information Capture System to Support Distributed Engineering Design Teams","Global Design to Gain a Competitive Edge","","","","10.1007/978-1-84800-239-5_22","A. P. ConwayA. J. WodehouseW. J. IonA. Lynn","2008","http://link.springer.com/chapter/10.1007/978-1-84800-239-5_22","Chapter"
"A Design of Product Collaborative Online Configuration Model","Cooperative Design, Visualization, and Engineering","","","","10.1007/978-3-642-04265-2_54","Xiaoguo WangJin ZhengQian Zeng","2009","http://link.springer.com/chapter/10.1007/978-3-642-04265-2_54","Chapter"
"A Constraint Solving Method for Collaborative Product Development","Cooperative Design, Visualization, and Engineering","","","","10.1007/978-3-642-16066-0_35","Tingting LiuZhaoying ZhangHuifen Wang","2010","http://link.springer.com/chapter/10.1007/978-3-642-16066-0_35","Chapter"
"Towards a Cooperative Visual Authoring Environment for Storytelling","Cooperative Design, Visualization, and Engineering","","","","10.1007/978-3-540-88011-0_44","Ivan BlecicArnaldo CecchiniGiuseppe A. Trunfio","2008","http://link.springer.com/chapter/10.1007/978-3-540-88011-0_44","Chapter"
"The boundaries of participatory citizenship","ECSCW 2009","","","","10.1007/978-1-84882-854-4_1","Nikolaj Gandrup BorchorstSusanne BødkerPär-Ola Zander","2009","http://link.springer.com/chapter/10.1007/978-1-84882-854-4_1","Chapter"
"Towards an ICT Framework for Providing Inclusive Learning Objects for Indigenous Learners","Emerging Issues in Smart Learning","","","","10.1007/978-3-662-44188-6_48","John LoewenDavid LoewenKinshukJarkko Suhonen","2015","http://link.springer.com/chapter/10.1007/978-3-662-44188-6_48","Chapter"
"Contents Recycling Using Content-Based Image Retrieval on Mobile Device","Image and Video Retrieval","","","","10.1007/11526346_44","Eunjung HanAnjin ParkKeechul Jung","2005","http://link.springer.com/chapter/10.1007/11526346_44","Chapter"
"Building an Intelligent, Authorable Serious Game for Autistic Children and Their Carers","Advances in Computer Entertainment","","","","10.1007/978-3-319-03161-3_34","Kaśka Porayska-PomstaKeith AndersonSara BernardiniKaren GuldbergTim SmithLila KossivakiScott HodginsIan Lowe","2013","http://link.springer.com/chapter/10.1007/978-3-319-03161-3_34","Chapter"
"A COMPARATIVE STUDY OF PROBLEM FRAMING IN MULTIPLE SETTINGS","Design Computing and Cognition ’06","","","","10.1007/978-1-4020-5131-9_13","THOMAS KVANSONG GAO","2006","http://link.springer.com/chapter/10.1007/978-1-4020-5131-9_13","Chapter"
"Dynamic Testing Via Automata Learning","Hardware and Software: Verification and Testing","","","","10.1007/978-3-540-77966-7_13","Harald RaffeltBernhard SteffenTiziana Margaria","2008","http://link.springer.com/chapter/10.1007/978-3-540-77966-7_13","Chapter"
"Making Sense of Communication Associated with Artifacts during Early Design Activity","Human-Computer Interaction – INTERACT 2011","","","","10.1007/978-3-642-23774-4_17","Moushumi SharminBrian P. Bailey","2011","http://link.springer.com/chapter/10.1007/978-3-642-23774-4_17","Chapter"
"Design Artefacts as Business Decision Prompts: Tackling the Design and Business Values Gap","Human-Computer Interaction. Applications and Services","","","","10.1007/978-3-319-07227-2_69","Joanna KwiatkowskaAgnieszka SzóstekDavid Lamas","2014","http://link.springer.com/chapter/10.1007/978-3-319-07227-2_69","Chapter"
"Formal Dialogue and Its Application to Team Formation in Cooperative Design","Computer Supported Cooperative Work in Design I","","","","10.1007/11568421_14","Yisheng AnRenhou Li","2005","http://link.springer.com/chapter/10.1007/11568421_14","Chapter"
"Building towards a Software Based Innovation Modelling Tool","Enterprise and Organizational Modeling and Simulation","","","","10.1007/978-3-642-24175-8_14","Paidi O’RaghallaighDavid SammonCiaran Murphy","2011","http://link.springer.com/chapter/10.1007/978-3-642-24175-8_14","Chapter"
"Using Annotations in a Collective and Face-to-Face Design Situation","ECSCW 2009","","","","10.1007/978-1-84882-854-4_11","Sylvie GuibertFrançoise DarsesJean-François Boujut","2009","http://link.springer.com/chapter/10.1007/978-1-84882-854-4_11","Chapter"
"When Designers Are Not in Control – Experiences from Using Action Research to Improve Researcher-Developer Collaboration in Design Science Research","Global Perspectives on Design Science Research","","","","10.1007/978-3-642-13335-0_1","Anders HjalmarssonDaniel RudmarkMikael Lind","2010","http://link.springer.com/chapter/10.1007/978-3-642-13335-0_1","Chapter"
"Playful Holistic Support to HCI Requirements Using LEGO Bricks","Human Centered Design","","","","10.1007/978-3-642-02806-9_97","Lorenzo CantoniLuca BotturiMarco FaréDavide Bolchini","2009","http://link.springer.com/chapter/10.1007/978-3-642-02806-9_97","Chapter"
"Promoting a Humanistic Perspective of Creativity by Interpersonal Qualities and Web-Based Tools","Visioning and Engineering the Knowledge Society. A Web Science Perspective","","","","10.1007/978-3-642-04754-1_1","Renate MotschnigTomáš Pitner","2009","http://link.springer.com/chapter/10.1007/978-3-642-04754-1_1","Chapter"
"The Method of User’s Requirement Analysis by Participation of the User: Constructing an Information System for Travelers","Human Centered Design","","","","10.1007/978-3-642-02806-9_99","Chia-Yin LinMakoto Okamoto","2009","http://link.springer.com/chapter/10.1007/978-3-642-02806-9_99","Chapter"
"Diffusion of Open Source ERP Systems Development: How Users Are Involved","Governance and Sustainability in Information Systems. Managing the Transfer and Diffusion of IT","","","","10.1007/978-3-642-24148-2_12","Björn Johansson","2011","http://link.springer.com/chapter/10.1007/978-3-642-24148-2_12","Chapter"
"Designing a Serious Game as a Diagnostic Tool","Games and Learning Alliance","","","","10.1007/978-3-319-22960-7_7","Pongpanote GongsookJanneke PeijnenborghErik van der SpekJun HuFrancesco BellottiRiccardo BertaAlessandro de GloriaFrancesco CuratelliChiara MartinengoMatthias RauterbergJos Hendriksen","2015","http://link.springer.com/chapter/10.1007/978-3-319-22960-7_7","Chapter"
"Web Information Systems Portfolios: A Contribution to Pragmatics","Web Information Systems and Technologies","","","","10.1007/978-3-642-22810-0_11","Klaus-Dieter ScheweBernhard Thalheim","2011","http://link.springer.com/chapter/10.1007/978-3-642-22810-0_11","Chapter"
"Emotions and Inclusion in Co-design at School: Let’s Measure Them!","Methodologies and Intelligent Systems for Technology Enhanced Learning","","","","10.1007/978-3-319-19632-9_1","Margherita BrondinoGabriella DoderoRosella GennariAlessandra MelonioMargherita PasiniDaniela RaccanelloSantina Torello","2015","http://link.springer.com/chapter/10.1007/978-3-319-19632-9_1","Chapter"
"Development of a Systems-Based Human Factors Design Approach for Road Safety Applications","Engineering Psychology and Cognitive Ergonomics. Applications and Services","","","","10.1007/978-3-642-39354-9_6","Gemma J. M. ReadPaul M. SalmonMichael G. Lenné","2013","http://link.springer.com/chapter/10.1007/978-3-642-39354-9_6","Chapter"
"Instruction, Feedback and Biometrics: The User Interface for Fingerprint Authentication Systems","Human-Computer Interaction – INTERACT 2009","","","","10.1007/978-3-642-03658-3_35","Chris RileyGraham JohnsonHeather McCrackenAhmed Al-Saffar","2009","http://link.springer.com/chapter/10.1007/978-3-642-03658-3_35","Chapter"
"Developing an Embodied Pedagogical Agent with and for Young People with Autism Spectrum Disorder","Intelligent Tutoring Systems","","","","10.1007/978-3-642-30950-2_33","Beate GrawemeyerHilary JohnsonMark BrosnanEmma AshwinLaura Benton","2012","http://link.springer.com/chapter/10.1007/978-3-642-30950-2_33","Chapter"
"Recent Developments and Future Trends of Industrial Agents","Holonic and Multi-Agent Systems for Manufacturing","","","","10.1007/978-3-642-23181-0_2","Paulo LeitãoPavel Vrba","2011","http://link.springer.com/chapter/10.1007/978-3-642-23181-0_2","Chapter"
"Guidelines to Integrate Professional, Personal and Social Context in Interaction Design Process: Studies in Healthcare Environment","Human-Computer Interaction: Design and Evaluation","","","","10.1007/978-3-319-20901-2_11","Janaina AbibJunia Anacleto","2015","http://link.springer.com/chapter/10.1007/978-3-319-20901-2_11","Chapter"
"On the Use of Feature Models for Service Design: The Case of Value Representation","Towards a Service-Based Internet. ServiceWave 2010 Workshops","","","","10.1007/978-3-642-22760-8_12","Erik WitternChristian Zirpins","2011","http://link.springer.com/chapter/10.1007/978-3-642-22760-8_12","Chapter"
"Method Card Design Dimensions: A Survey of Card-Based Design Tools","Human-Computer Interaction – INTERACT 2013","","","","10.1007/978-3-642-40483-2_34","Christiane WölfelTimothy Merritt","2013","http://link.springer.com/chapter/10.1007/978-3-642-40483-2_34","Chapter"
"Towards a Paperless Air Traffic Control Tower","Human Centered Design","","","","10.1007/978-3-642-21753-1_41","Tanja BosMarian Schuver–van BlankenHans Huisman","2011","http://link.springer.com/chapter/10.1007/978-3-642-21753-1_41","Chapter"
