Item Title,Publication Title,Book Series Title,Journal Volume,Journal Issue,Item DOI,Authors,Publication Year,URL,Content Type
"Towards Rapid Technology Probes for Senior People","Human Factors in Computing and Informatics","","","","10.1007/978-3-642-39062-3_47","Florian GüldenpfennigGeraldine Fitzpatrick","2013","http://link.springer.com/chapter/10.1007/978-3-642-39062-3_47","Chapter"
"Penan’s Oroo’ Short Message Signs (PO-SMS): Co-design of a Digital Jungle Sign Language Application","Human-Computer Interaction – INTERACT 2015","","","","10.1007/978-3-319-22668-2_38","Tariq ZamanHeike Winschiers-Theophilus","2015","http://link.springer.com/chapter/10.1007/978-3-319-22668-2_38","Chapter"
"The Enterprise Architecture Body of Knowledge as an Evolving Discipline","Enterprise Information Systems","","","","10.1007/978-3-642-40654-6_27","Hadi KandjaniPeter Bernus","2013","http://link.springer.com/chapter/10.1007/978-3-642-40654-6_27","Chapter"
"Graph-Based Inferences in a Semantic Web Server for the Cartography of Competencies in a Telecom Valley","The Semantic Web – ISWC 2005","","","","10.1007/11574620_20","Fabien GandonOlivier CorbyAlain GiboinNicolas GronnierCecile Guigard","2005","http://link.springer.com/chapter/10.1007/11574620_20","Chapter"
"Integrating Multi-viewpoints Paradigm in Ontology Using Ontology Design Patterns","New Trends in Database and Information Systems II","","","","10.1007/978-3-319-10518-5_20","Soumaya KasriFouzia Benchikha","2015","http://link.springer.com/chapter/10.1007/978-3-319-10518-5_20","Chapter"
"Towards Agent Dialogue as a Tool for Capturing Software Design Discussions","Theory and Applications of Formal Argumentation","","","","10.1007/978-3-642-54373-9_7","Elizabeth BlackPeter McBurneySteffen Zschaler","2014","http://link.springer.com/chapter/10.1007/978-3-642-54373-9_7","Chapter"
"BPM-in-the-Large – Towards a Higher Level of Abstraction in Business Process Management","E-Government, E-Services and Global Processes","","","","10.1007/978-3-642-15346-4_19","Constantin HouyPeter FettkePeter LoosWil M. P. van der AalstJohn Krogstie","2010","http://link.springer.com/chapter/10.1007/978-3-642-15346-4_19","Chapter"
"How to Teach Computing in AEC","Intelligent Computing in Engineering and Architecture","","","","10.1007/11888598_42","Karsten MenzelDanijel ReboljŽiga Turk","2006","http://link.springer.com/chapter/10.1007/11888598_42","Chapter"
"Research on Process-Oriented Design Method and Technology","Advances in Computer Science, Intelligent System and Environment","","","","10.1007/978-3-642-23777-5_74","Songbo HuangGuangrong YanSijia Yu","2011","http://link.springer.com/chapter/10.1007/978-3-642-23777-5_74","Chapter"
"Natural Language-Based Approach for Helping in the Reuse of Ontology Design Patterns","Knowledge Engineering: Practice and Patterns","","","","10.1007/978-3-540-87696-0_6","Guadalupe Aguado de CeaAsunción Gómez-PérezElena Montiel-PonsodaMari Carmen Suárez-Figueroa","2008","http://link.springer.com/chapter/10.1007/978-3-540-87696-0_6","Chapter"
"Validating Ontologies with OOPS!","Knowledge Engineering and Knowledge Management","","","","10.1007/978-3-642-33876-2_24","María Poveda-VillalónMari Carmen Suárez-FigueroaAsunción Gómez-Pérez","2012","http://link.springer.com/chapter/10.1007/978-3-642-33876-2_24","Chapter"
"On Interacting with Collective Knowledge of Group Facilitation","Computational Collective Intelligence. Technologies and Applications","","","","10.1007/978-3-642-40495-5_26","Constantin-Bala ZamfirescuCiprian Candea","2013","http://link.springer.com/chapter/10.1007/978-3-642-40495-5_26","Chapter"
"Proactive Engineering and PLM: Current Status and Research Challenges","Product Lifecycle Management for Society","","","","10.1007/978-3-642-41501-2_18","Frédéric DemolyHenk Jan PelsSamuel Gomes","2013","http://link.springer.com/chapter/10.1007/978-3-642-41501-2_18","Chapter"
"Distributed Data Visualization Tools for Multidisciplinary Design Optimization of Aero-crafts","Advances in Multimedia Information Processing - PCM 2006","","","","10.1007/11922162_108","Chunsheng LiuTianxu Zhang","2006","http://link.springer.com/chapter/10.1007/11922162_108","Chapter"
"Multi-objective Analysis on Optimization of Negotiation Support","Active Media Technology","","","","10.1007/978-3-642-04875-3_38","Yu-Teng ChangChih-Yao LoPing-Chang ChenShu-Huei Han","2009","http://link.springer.com/chapter/10.1007/978-3-642-04875-3_38","Chapter"
"Multi-resource Load Optimization Strategy in Agent-Based Systems","Agent and Multi-Agent Systems: Technologies and Applications","","","","10.1007/978-3-540-72830-6_36","Leszek ŚliwkoAleksander Zgrzywa","2007","http://link.springer.com/chapter/10.1007/978-3-540-72830-6_36","Chapter"
"The Web as an Infrastructure for Knowledge Management: Lessons Learnt","Advances in Swarm and Computational Intelligence","","","","10.1007/978-3-319-20472-7_47","Aurélien BénelL’Hédi Zaher","2015","http://link.springer.com/chapter/10.1007/978-3-319-20472-7_47","Chapter"
"Semantic Web-Techniques and Software Agents for the Automatic Integration of Virtual Prototypes","Virtual and Mixed Reality - Systems and Applications","","","","10.1007/978-3-642-22024-1_43","Rafael RadkowskiFlorian Weidemann","2011","http://link.springer.com/chapter/10.1007/978-3-642-22024-1_43","Chapter"
"Social Action-Based Learning in Construction Education: A New Teaching Strategy","Advances in Web-Based Learning – ICWL 2013","","","","10.1007/978-3-642-41175-5_17","Yu-Chieh WuJie-Chi Yang","2013","http://link.springer.com/chapter/10.1007/978-3-642-41175-5_17","Chapter"
"The FishbowlTM: Degrees of Engagement in Global Teamwork","Intelligent Computing in Engineering and Architecture","","","","10.1007/11888598_24","Renate Fruchter","2006","http://link.springer.com/chapter/10.1007/11888598_24","Chapter"
"Modelling Social Attitudes of Agents","Agent and Multi-Agent Systems: Technologies and Applications","","","","10.1007/978-3-540-72830-6_7","Matteo CristaniElisa Burato","2007","http://link.springer.com/chapter/10.1007/978-3-540-72830-6_7","Chapter"
"Gaming the Future of the Ocean: The Marine Spatial Planning Challenge 2050","Serious Games Development and Applications","","","","10.1007/978-3-319-11623-5_13","Igor MayerQiqi ZhouXander KeijserLodewijk Abspoel","2014","http://link.springer.com/chapter/10.1007/978-3-319-11623-5_13","Chapter"
"Design of Mobile Applications for People with Intellectual Disabilities","Creativity in Intelligent Technologies and Data Science","","","","10.1007/978-3-319-23766-4_65","","2015","http://link.springer.com/chapter/10.1007/978-3-319-23766-4_65","Chapter"
"Lessons Learned on Developing Educational Systems Using a Hybrid User Centered Methodology","New Contributions in Information Systems and Technologies","","","","10.1007/978-3-319-16528-8_20","António Pedro CostaLuis Paulo ReisMaria João Loureiro","2015","http://link.springer.com/chapter/10.1007/978-3-319-16528-8_20","Chapter"
"Towards a Serious Game for Trauma Treatment","Serious Games Development and Applications","","","","10.1007/978-3-642-40790-1_6","Simon MayrPaolo Petta","2013","http://link.springer.com/chapter/10.1007/978-3-642-40790-1_6","Chapter"
"Co-creating Networked Educational Innovations via Process Simulations","Frontiers in Gaming Simulation","","","","10.1007/978-3-319-04954-0_17","Riitta SmedsSvante SuominenPäivi Pöyry-Lassila","2014","http://link.springer.com/chapter/10.1007/978-3-319-04954-0_17","Chapter"
"SADT/IDEF0 for Augmenting UML, Agile and Usability Engineering Methods","Software and Data Technologies","","","","10.1007/978-3-642-36177-7_3","David A. Marca","2013","http://link.springer.com/chapter/10.1007/978-3-642-36177-7_3","Chapter"
"Improving the Language Active Learning with Multiagent Systems","Intelligent Data Engineering and Automated Learning - IDEAL 2009","","","","10.1007/978-3-642-04394-9_88","Cristian PinzónVivian LópezJavier BajoJuan M. Corchado","2009","http://link.springer.com/chapter/10.1007/978-3-642-04394-9_88","Chapter"
"Building Autonomous Social Partners for Autistic Children","Intelligent Virtual Agents","","","","10.1007/978-3-642-33197-8_5","Sara BernardiniKaska Porayska-PomstaTim J. SmithKaterina Avramides","2012","http://link.springer.com/chapter/10.1007/978-3-642-33197-8_5","Chapter"
"Multi-disciplinary Design and In-Home Evaluation of Kinect-Based Exercise Coaching System for Elderly","Human Aspects of IT for the Aged Population. Design for Everyday Life","","","","10.1007/978-3-319-20913-5_10","Gregorij KurilloFerda OfliJennifer MarcoePaul GormanHolly JimisonMisha PavelRuzena Bajcsy","2015","http://link.springer.com/chapter/10.1007/978-3-319-20913-5_10","Chapter"
"Multiagent-Based Educational Environment for Dependents","Bio-Inspired Systems: Computational and Ambient Intelligence","","","","10.1007/978-3-642-02478-8_76","Antonia MacarroAlberto PedreroJuan A. Fraile","2009","http://link.springer.com/chapter/10.1007/978-3-642-02478-8_76","Chapter"
"An Activity Theory Approach to Intuitiveness: From Artefact to Process","Human-Computer Interaction: Design and Evaluation","","","","10.1007/978-3-319-20901-2_1","Sturla Bakke","2015","http://link.springer.com/chapter/10.1007/978-3-319-20901-2_1","Chapter"
"A Multi-touch Tool for Co-creation","Human-Computer Interaction – INTERACT 2009","","","","10.1007/978-3-642-03658-3_21","Geke D. S. LuddenTom Broens","2009","http://link.springer.com/chapter/10.1007/978-3-642-03658-3_21","Chapter"
"Space as a Resource in Creative Design Practices","Human-Computer Interaction – INTERACT 2009","","","","10.1007/978-3-642-03658-3_23","Dhaval VyasGerrit van der VeerDirk HeylenAnton Nijholt","2009","http://link.springer.com/chapter/10.1007/978-3-642-03658-3_23","Chapter"
"The Realization of Custom Extending Attribute Information of AutoCAD","Advanced Research on Computer Science and Information Engineering","","","","10.1007/978-3-642-21402-8_34","Xiaosheng LiuFeihui HuXiaoyu Zhang","2011","http://link.springer.com/chapter/10.1007/978-3-642-21402-8_34","Chapter"
"Deploying Autonomous Coordinating Agent for Assessment Model in Smart Urban Space: A Case Study of Cozy Space Design Pattern","Intelligent Technologies and Engineering Systems","","","","10.1007/978-1-4614-6747-2_27","Chiung-Hui Chen","2013","http://link.springer.com/chapter/10.1007/978-1-4614-6747-2_27","Chapter"
"I-Candies: Supporting Semi-formal Communication in a Coffee Corner","Human-Computer Interaction – INTERACT 2007","","","","10.1007/978-3-540-74800-7_69","Khairun FachryIngrid MulderHenk EertinkHans Zandbelt","2007","http://link.springer.com/chapter/10.1007/978-3-540-74800-7_69","Chapter"
"Provenance Management for Data Exploration","Data Integration in the Life Sciences","","","","10.1007/978-3-642-15120-0_1","Juliana Freire","2010","http://link.springer.com/chapter/10.1007/978-3-642-15120-0_1","Chapter"
"Design and Implementation of Collaboration Support in Virtual Experiment Environment","Advances in Web-Based Learning – ICWL 2010","","","","10.1007/978-3-642-17407-0_43","Yu ShengJianxin WangWeiping WangLanying Liu","2010","http://link.springer.com/chapter/10.1007/978-3-642-17407-0_43","Chapter"
"Narrowing the Gap Between Humans and Agents in e-Commerce: 3D Electronic Institutions","E-Commerce and Web Technologies","","","","10.1007/11545163_13","Anton BogdanovychHelmut BergerSimeon SimoffCarles Sierra","2005","http://link.springer.com/chapter/10.1007/11545163_13","Chapter"
"Interoperability for GIS Document Management in Environmental Planning","Journal on Data Semantics III","","","","10.1007/11496168_5","Gilberto Zonta PastorelloClaudia Bauzer MedeirosSilvania Maria de ResendeHenrique Aparecido da Rocha","2005","http://link.springer.com/chapter/10.1007/11496168_5","Chapter"
"A Diagnostic Tool on Time Perception of Children with ADHD","Games and Learning Alliance","","","","10.1007/978-3-319-12157-4_35","Pongpanote GongsookJanneke PeijnenborghChristian SallustroErik van der SpekJun HuFrancesco BellottiMatthias RauterbergJos Hendriksen","2014","http://link.springer.com/chapter/10.1007/978-3-319-12157-4_35","Chapter"
"Interrogating Capabilities of IoT Devices","Provenance and Annotation of Data and Processes","","","","10.1007/978-3-319-16462-5_15","Stanislav BeranEdoardo PignottiPeter Edwards","2015","http://link.springer.com/chapter/10.1007/978-3-319-16462-5_15","Chapter"
"Personalized e-Health for Elderly Self-care and Empowerment","Ambient Intelligence - Software and Applications","","","","10.1007/978-3-642-28783-1_27","Viveca Jiménez-MixcoMaria Fernanda Cabrera-UmpiérrezAlberto Esteban BlancoMaria Teresa Arredondo WaldmeyerDaniel TantingerSilvio Bonfiglio","2012","http://link.springer.com/chapter/10.1007/978-3-642-28783-1_27","Chapter"
"Ambient Gaming and Play: Opportunities and Challenges","Constructing Ambient Intelligence","","","","10.1007/978-3-642-31479-7_36","Janienke SturmBen Schouten","2012","http://link.springer.com/chapter/10.1007/978-3-642-31479-7_36","Chapter"
"Improvisational Theater for Information Systems: An Agile, Experience-Based, Prototyping Technique","Advanced Information Systems Engineering","","","","10.1007/978-3-642-31095-9_47","Martin MahauxPatrick Heymans","2012","http://link.springer.com/chapter/10.1007/978-3-642-31095-9_47","Chapter"
"Mily’s World: A Coordinate Geometry Learning Environment with Game-Like Properties","Intelligent Tutoring Systems","","","","10.1007/978-3-642-13437-1_83","Dovan RaiJoseph E. BeckNeil T. Heffernan","2010","http://link.springer.com/chapter/10.1007/978-3-642-13437-1_83","Chapter"
"hvMuseum: A Participatory Online Museum of Everyday Artifacts for Cultural Awareness","HCI International 2011 – Posters’ Extended Abstracts","","","","10.1007/978-3-642-22098-2_43","Young-ae Hahn","2011","http://link.springer.com/chapter/10.1007/978-3-642-22098-2_43","Chapter"
"The Challenge of Visualizing Patient Histories on a Mobile Device","Human-Computer Interaction - INTERACT 2005","","","","10.1007/11555261_75","Carmelo ArditoPaolo BuonoMaria Francesca Costabile","2005","http://link.springer.com/chapter/10.1007/11555261_75","Chapter"
"Interplay between Usability Evaluation and Software Development (I-USED 2009)","Human-Computer Interaction – INTERACT 2009","","","","10.1007/978-3-642-03658-3_135","Silvia AbrahãoKasper HornbækEffie LawJan Stage","2009","http://link.springer.com/chapter/10.1007/978-3-642-03658-3_135","Chapter"
"Ambient Urban Games for Reducing the Stress of Commuters Crossing the Mexico-US Border","Ubiquitous Computing and Ambient Intelligence. Context-Awareness and Context-Driven Interaction","","","","10.1007/978-3-319-03176-7_52","Marcela D. RodríguezCecilia M. Curlango Rosas","2013","http://link.springer.com/chapter/10.1007/978-3-319-03176-7_52","Chapter"
"User-Centred ICT-Design for Occupational Health: A Case Description","Health Information Science","","","","10.1007/978-3-642-37899-7_26","Marjo Rissanen","2013","http://link.springer.com/chapter/10.1007/978-3-642-37899-7_26","Chapter"
"A Tangible Platform for Mixing and Remixing Narratives","Advances in Computer Entertainment","","","","10.1007/978-3-319-03161-3_69","Cristina SyllaSérgio GonçalvesPaulo BritoPedro BrancoClara Coutinho","2013","http://link.springer.com/chapter/10.1007/978-3-319-03161-3_69","Chapter"
"Ethics, Roles and Relationships in Interaction Design in Developing Regions","Human-Computer Interaction – INTERACT 2009","","","","10.1007/978-3-642-03658-3_132","Anxo Ceriejo-RoibasAndy DeardenSusan DrayPhil GrayJohn ThomasNiall Winters","2009","http://link.springer.com/chapter/10.1007/978-3-642-03658-3_132","Chapter"
"Supporting Behavior Change in Cooperative Driving","Constructing Ambient Intelligence","","","","10.1007/978-3-642-31479-7_55","Qonita Shahab","2012","http://link.springer.com/chapter/10.1007/978-3-642-31479-7_55","Chapter"
"Socially Responsible Design in the Context of International Development","Human-Computer Interaction – INTERACT 2007","","","","10.1007/978-3-540-74800-7_87","A. DeardenL. DunckleyM. BestS. DrayA. LightJ. Thomas","2007","http://link.springer.com/chapter/10.1007/978-3-540-74800-7_87","Chapter"
"A Paradigm Shift in Business Valuation Process Using Fuzzy Logic","Soft Computing in Management and Business Economics","","","","10.1007/978-3-642-30451-4_13","Anna M. Gil-LafuenteCésar Castillo-LópezFabio Raúl Blanco-Mesa","2012","http://link.springer.com/chapter/10.1007/978-3-642-30451-4_13","Chapter"
"Controling Contract Net Protocol by Local Observation for Large-Scale Multi-Agent Systems","Cooperative Information Agents XII","","","","10.1007/978-3-540-85834-8_17","Toshiharu SugawaraToshio HirotsuSatoshi KuriharaKensuke Fukuda","2008","http://link.springer.com/chapter/10.1007/978-3-540-85834-8_17","Chapter"
"Sensor Data Meets Social Networks Reflecting on Benefits in the Case of a Patient Room","Availability, Reliability, and Security in Information Systems and HCI","","","","10.1007/978-3-642-40511-2_1","Fabienne KuhnAndreas SpichigerReinhard Riedl","2013","http://link.springer.com/chapter/10.1007/978-3-642-40511-2_1","Chapter"
"A Study on BDI Agent for the Integration of Engineering Processes","Cooperative Design, Visualization, and Engineering","","","","10.1007/11863649_19","Hanmin LeeSeong-Whan ParkJai-Kyung LeeJe-Sung BangJaeho Lee","2006","http://link.springer.com/chapter/10.1007/11863649_19","Chapter"
"A Unique Arrangement: Organizing Collections for Digital Libraries, Archives, and Repositories","Theory and Practice of Digital Libraries","","","","10.1007/978-3-642-33290-6_36","Jeff CrowLuis Francisco-RevillaApril NorrisShilpa ShuklaCiaran B. Trace","2012","http://link.springer.com/chapter/10.1007/978-3-642-33290-6_36","Chapter"
"Designs Can Talk: A Case of Feedback for Design Evolution in Assistive Technology","Design Requirements Engineering: A Ten-Year Perspective","","","","10.1007/978-3-540-92966-6_12","William N. RobinsonStephen Fickas","2009","http://link.springer.com/chapter/10.1007/978-3-540-92966-6_12","Chapter"
"Pro-active Environment for Assisted Model Composition","Cooperative Design, Visualization, and Engineering","","","","10.1007/978-3-540-74780-2_8","Sascha OpletalEmil StoyanovDieter Roller","2007","http://link.springer.com/chapter/10.1007/978-3-540-74780-2_8","Chapter"
"Supporting Software Services’ Trustworthiness in Collaborative Networks","Collaborative Networks for a Sustainable World","","","","10.1007/978-3-642-15961-9_80","Maiara Heil CancianRicardo J. RabeloChristiane Gresse von Wangenheim","2010","http://link.springer.com/chapter/10.1007/978-3-642-15961-9_80","Chapter"
"Pattern Use in Knowledge Architectures:An Example from Information Logistics","Perspectives in Business Informatics Research","","","","10.1007/978-3-642-40823-6_8","Kurt Sandkuhl","2013","http://link.springer.com/chapter/10.1007/978-3-642-40823-6_8","Chapter"
"Constraint Information Visualization Methodology for Cooperative Design","Computer Supported Cooperative Work in Design III","","","","10.1007/978-3-540-72863-4_7","Xiaoping LiuHui ShiZhengqiang MaoQiang Lu","2007","http://link.springer.com/chapter/10.1007/978-3-540-72863-4_7","Chapter"
"Group Learning of Programming by means of Real Time Distributed Collaboration Techniques","HCI related papers of Interacción 2004","","","","10.1007/1-4020-4205-1_24","Crescencio BravoMiguel á. RedondoAntonio J. MendesManuel Ortega","2006","http://link.springer.com/chapter/10.1007/1-4020-4205-1_24","Chapter"
"Operational Design In VO Supply Networks Creation","Network-Centric Collaboration and Supporting Frameworks","","","","10.1007/978-0-387-38269-2_40","Cathal HeaveyP J ByrnePaul ListonJames Byrne","2006","http://link.springer.com/chapter/10.1007/978-0-387-38269-2_40","Chapter"
"Automated Outsourcing Partnership Management Using Semantic Web Services","Computer Supported Cooperative Work in Design II","","","","10.1007/11686699_19","Woongsup KimMoon-Jung ChungJohn Lloyd","2006","http://link.springer.com/chapter/10.1007/11686699_19","Chapter"
"The Ship Propeller Design System for Coupling of CAD, CAE and CAO","Information Computing and Applications","","","","10.1007/978-3-642-34038-3_22","Jinfeng Huang","2012","http://link.springer.com/chapter/10.1007/978-3-642-34038-3_22","Chapter"
"Study on Product Lifecycle Oriented Product Design Quality Control System","International Asia Conference on Industrial Engineering and Management Innovation (IEMI2012) Proceedings","","","","10.1007/978-3-642-38445-5_82","Xing-yu JiangLong-zhen XuXin-min ZhangYe Bian","2013","http://link.springer.com/chapter/10.1007/978-3-642-38445-5_82","Chapter"
"Process-Oriented DFM System for Ubiquitous Devices","Computational Science and Its Applications - ICCSA 2006","","","","10.1007/11751632_75","Yongsik KimTaesoo LimDongsoo KimCheol JungHonggee Jin","2006","http://link.springer.com/chapter/10.1007/11751632_75","Chapter"
"Communicating the Value of PSS Design Alternatives using Color-Coded CAD Models","Functional Thinking for Value Creation","","","","10.1007/978-3-642-19689-8_11","Alessandro BertoniMarco BertoniOla Isaksson","2011","http://link.springer.com/chapter/10.1007/978-3-642-19689-8_11","Chapter"
"Design Professionals Involved in Design Management: Roles and Interactions in Different Scenarios: A Systematic Review","ICoRD'13","","","","10.1007/978-81-322-1050-4_69","Cláudia Souza LibânioFernando Gonçalves Amaral","2013","http://link.springer.com/chapter/10.1007/978-81-322-1050-4_69","Chapter"
"A Fluid Flow Approach to Usability Analysis of Multi-user Systems","Engineering Interactive Systems","","","","10.1007/978-3-540-85992-5_15","Mieke MassinkDiego LatellaMaurice H. ter BeekMichael D. HarrisonMichele Loreti","2008","http://link.springer.com/chapter/10.1007/978-3-540-85992-5_15","Chapter"
"Process Model Difference Analysis for Supporting Process Evolution","Software Process Improvement","","","","10.1007/11908562_12","Martín SotoJürgen Münch","2006","http://link.springer.com/chapter/10.1007/11908562_12","Chapter"
"Different Function Breakdowns for One Existing Product: Experimental Results","Design Computing and Cognition ’10","","","","10.1007/978-94-007-0510-4_22","Thomas AlinkClaudia EckertAnne RuckpaulAlbert Albers","2011","http://link.springer.com/chapter/10.1007/978-94-007-0510-4_22","Chapter"
"Framework of a Collaboration-Based Engineering Service System for Mould Industry","Computational Science and Its Applications – ICCSA 2007","","","","10.1007/978-3-540-74484-9_4","Chang Ho LeeYong Ju Cho","2007","http://link.springer.com/chapter/10.1007/978-3-540-74484-9_4","Chapter"
"Dempster–Shafer Theory Based Consensus Building in Collaborative Conceptual Modeling","Proceedings of the International Conference on Human-centric Computing 2011 and Embedded and Multimedia Computing 2011","","","","10.1007/978-94-007-2105-0_16","Lili JiaHuiping ZhouZhiying WangChengzheng Sun","2011","http://link.springer.com/chapter/10.1007/978-94-007-2105-0_16","Chapter"
"Specimen’s behavior management: A masterpiece for Biodiversity Information System’s representation","Information Technologies in Environmental Engineering","","","","10.1007/978-3-540-88351-7_42","Didier SébastienRémy CourdierNoël ConruytNicolas SébastienTullio Tanzi","2009","http://link.springer.com/chapter/10.1007/978-3-540-88351-7_42","Chapter"
"Generative Art Images by Complex Functions Based Genetic Algorithm","Trends in Computer Aided Innovation","","","","10.1007/978-0-387-75456-7_13","Hong LiuXiyu Liu","2007","http://link.springer.com/chapter/10.1007/978-0-387-75456-7_13","Chapter"
"Research on a Kind of Optimization Scheme of MIMO-OFDM Sphere Equalization Technology for Unmanned Aerial Vehicle Wireless Image Transmission Data Link System","Advanced Computer Architecture","","","","10.1007/978-3-662-44491-7_19","Jian ZhaoHengzhu LiuXucan ChenBotao ZhangTing Chen","2014","http://link.springer.com/chapter/10.1007/978-3-662-44491-7_19","Chapter"
"Avatar Expression Agent in Virtual Architecture","Computer-Aided Architectural Design Futures (CAADFutures) 2007","","","","10.1007/978-1-4020-6528-6_27","Jumphon LertlakkhanakulSun-Hwie HwangJin-Won Choi","2007","http://link.springer.com/chapter/10.1007/978-1-4020-6528-6_27","Chapter"
"The Facets of Sociomateriality: A Systematic Mapping of Emerging Concepts and Definitions","Nordic Contributions in IS Research","","","","10.1007/978-3-642-39832-2_6","Elena ParmiggianiMarius Mikalsen","2013","http://link.springer.com/chapter/10.1007/978-3-642-39832-2_6","Chapter"
"Complexity in Collaborative Online Socio-Interationist Environments: A Good Reason for Distributed Systems","Advanced Distributed Systems","","","","10.1007/11533962_20","Hilton José Silva de AzevedoEdson Emílio Scalabrin","2005","http://link.springer.com/chapter/10.1007/11533962_20","Chapter"
"Information Cultures and Counter-Cultures","The Information Society: Emerging Landscapes","","","","10.1007/0-387-31168-8_1","Colin Beardon","2006","http://link.springer.com/chapter/10.1007/0-387-31168-8_1","Chapter"
"Repurposing Serious Games in Health Care Education","XII Mediterranean Conference on Medical and Biological Engineering and Computing 2010","","","","10.1007/978-3-642-13039-7_244","A. ProtopsaltisD. PanzoliI. DunwellS. de Freitas","2010","http://link.springer.com/chapter/10.1007/978-3-642-13039-7_244","Chapter"
"Software Development Processes for Games: A Systematic Literature Review","Systems, Software and Services Process Improvement","","","","10.1007/978-3-662-43896-1_16","Ann Osborne O’HaganGerry ColemanRory V. O’Connor","2014","http://link.springer.com/chapter/10.1007/978-3-662-43896-1_16","Chapter"
