Item Title,Publication Title,Book Series Title,Journal Volume,Journal Issue,Item DOI,Authors,Publication Year,URL,Content Type
"Digitizing creativity evaluation in design education: a systematic literature review","International Journal of Technology and Design Education","","","","10.1007/s10798-023-09846-6","Nandita Bhanja ChaudhuriDebayan Dhar","2023","http://link.springer.com/article/10.1007/s10798-023-09846-6","Article"
"Promises of industry 4.0 under the magnifying glass of interdisciplinarity: revealing operators and managers work and challenging collaborative robot design","Cognition, Technology & Work","","25","2 - 3","10.1007/s10111-023-00726-6","Flore BarcelliniRichard BéaréeTahar-Hakim BenchekrounMouad BounouarWilly BuchmannGérard DubeyAnne-Cécile LafeuilladeCaroline MoricotCéline Rosselin-BareilleMarco SaracenoAli Siadat","2023","http://link.springer.com/article/10.1007/s10111-023-00726-6","Article"
"Cyber risk management for autonomous passenger ships using threat-informed defense-in-depth","International Journal of Information Security","","22","1","10.1007/s10207-022-00638-y","Ahmed AmroVasileios Gkioulos","2023","http://link.springer.com/article/10.1007/s10207-022-00638-y","Article"
"Accessible wayfinding and navigation: a systematic mapping study","Universal Access in the Information Society","","22","1","10.1007/s10209-021-00843-x","Catia PrandiBarbara Rita BarricelliSilvia MirriDaniela Fogli","2023","http://link.springer.com/article/10.1007/s10209-021-00843-x","Article"
"Will we ever eradicate animal tuberculosis?","Irish Veterinary Journal","","76","1","10.1186/s13620-023-00254-9","Christian GortázarJosé de la FuenteAlberto PerellóLucas Domínguez","2023","http://link.springer.com/article/10.1186/s13620-023-00254-9","Article"
"Foresight science in conservation: Tools, barriers, and mainstreaming opportunities","Ambio","","52","2","10.1007/s13280-022-01786-0","Gabrielle EdnieTyreen KapoorOlga KoppelMorgan L. PiczakJessica L. ReidAlyssa D. MurdochCarly N. CookWilliam J. SutherlandSteven J. Cooke","2023","http://link.springer.com/article/10.1007/s13280-022-01786-0","Article"
"Does agile methodology fit all characteristics of software projects? Review and analysis","Empirical Software Engineering","","28","4","10.1007/s10664-023-10334-7","David ItzikGelbard Roy","2023","http://link.springer.com/article/10.1007/s10664-023-10334-7","Article"
"How effective are protected areas for reducing threats to biodiversity? A systematic review protocol","Environmental Evidence","","12","1","10.1186/s13750-023-00311-4","Katherine Pulido-ChadidElina VirtanenJonas Geldmann","2023","http://link.springer.com/article/10.1186/s13750-023-00311-4","Article"
"The research on the green leadership: a systematic review and theoretical framework","Environment, Development and Sustainability","","","","10.1007/s10668-023-03960-0","Jie ZhongXiaojing ShaoHuan XiaoRui YangXin An","2023","http://link.springer.com/article/10.1007/s10668-023-03960-0","Article"
"Green and sustainable business models: historical roots, growth trajectory, conceptual architecture and an agenda for future research—A bibliometric review of green and sustainable business models","Scientometrics","","128","2","10.1007/s11192-022-04577-2","Arash NajmaeiZahra Sadeghinejad","2023","http://link.springer.com/article/10.1007/s11192-022-04577-2","Article"
"Innovation for improving climate-related data—Lessons learned from setting up a data hub","AStA Wirtschafts- und Sozialstatistisches Archiv","","","","10.1007/s11943-023-00326-w","Hendrik Christian DollGabriela Alves Werb","2023","http://link.springer.com/article/10.1007/s11943-023-00326-w","Article"
"Responsible Social Robotics and the Dilemma of Control","International Journal of Social Robotics","","","","10.1007/s12369-023-01049-2","Marianna Capasso","2023","http://link.springer.com/article/10.1007/s12369-023-01049-2","Article"
"Semi-automatic service value network modeling approach based on external public data","Software and Systems Modeling","","22","2","10.1007/s10270-022-01014-z","Jingying WangChao MaHuixin XuZhiying TuXiaofei XuHanchuan XuZhongjie Wang","2023","http://link.springer.com/article/10.1007/s10270-022-01014-z","Article"
"Identifying the skills requirements related to industrial symbiosis and energy efficiency for the European process industry","Environmental Sciences Europe","","35","1","10.1186/s12302-023-00762-z","Tugce AkyaziAitor GotiFelix BayónMichael KohlgrüberAntonius Schröder","2023","http://link.springer.com/article/10.1186/s12302-023-00762-z","Article"
"A democratic way of controlling artificial general intelligence","AI & SOCIETY","","38","4","10.1007/s00146-022-01426-x","Jussi Salmi","2023","http://link.springer.com/article/10.1007/s00146-022-01426-x","Article"
"Enabling urban systems transformations: co-developing national and local strategies","Urban Transformations","","5","1","10.1186/s42854-023-00049-9","Robert WebbTayanah O’DonnellKate AutyXuemei BaiGuy BarnettRobert CostanzaJago DodsonPeter NewmanPeter NewtonEleanor RobsonChris RyanMark Stafford Smith","2023","http://link.springer.com/article/10.1186/s42854-023-00049-9","Article"
"Music recommendation systems to support music therapy in patients with dementia: an exploratory study","Research on Biomedical Engineering","","39","3","10.1007/s42600-023-00295-7","Ingrid Bruno NunesMaíra Araujo de SantanaJuliana Carneiro GomesArianne Sarmento TorcateNicole CharronNathália Córdula de BritoGiselle Machado Magalhães MorenoCristine Martins Gomes de GusmãoWellington Pinheiro dos Santos","2023","http://link.springer.com/article/10.1007/s42600-023-00295-7","Article"
"The Importance of Social Engagement in the Development of an HIV Cure: A Systematic Review of Stakeholder Perspectives","AIDS and Behavior","","27","11","10.1007/s10461-023-04095-z","Maaike A. J. NoormanJohn B. F. de WitTamika A. MarcosSarah E. StutterheimKai J. JonasChantal den Daas","2023","http://link.springer.com/article/10.1007/s10461-023-04095-z","Article"
"Systematic evaluation of guidelines for laparoscopic surgery and endoscopic management for colon cancer","Langenbeck's Archives of Surgery","","408","1","10.1007/s00423-023-02795-7","Hai-Jing LiYue-Ying LinXu-Dong MaZhang-Xiong LiangChao-Si WangDai-Yan WenDa-Li SunYong-Qing Duan","2023","http://link.springer.com/article/10.1007/s00423-023-02795-7","Article"
"Effects of Adaptive Prompts in Virtual Reality-Based Social Skills Training for Children with Autism","Journal of Autism and Developmental Disorders","","","","10.1007/s10803-023-06021-7","Jewoong MoonFengfeng Ke","2023","http://link.springer.com/article/10.1007/s10803-023-06021-7","Article"
"Bioethics in Northeast Asia","Asian Bioethics Review","","15","4","10.1007/s41649-023-00260-7","Graeme T. Laurie","2023","http://link.springer.com/article/10.1007/s41649-023-00260-7","Article"
"A Competency Framework for Participatory Modeling","Group Decision and Negotiation","","32","3","10.1007/s10726-023-09818-0","Sondoss ElsawahElena BakhanovaRaimo P. HämäläinenAlexey Voinov","2023","http://link.springer.com/article/10.1007/s10726-023-09818-0","Article"
"Disruption mitigation in the semiconductors supply chain by using public blockchains","The Journal of Supercomputing","","","","10.1007/s11227-023-05543-2","Mirna MagdyMohamed GridaGawaher Hussein","2023","http://link.springer.com/article/10.1007/s11227-023-05543-2","Article"
"A systematic review of uncertainty theory with the use of scientometrical method","Fuzzy Optimization and Decision Making","","22","3","10.1007/s10700-022-09400-4","Jian ZhouYujiao JiangAthanasios A. PantelousWeiwen Dai","2023","http://link.springer.com/article/10.1007/s10700-022-09400-4","Article"
"The Data in Emergencies (DIEM) Hub for evaluating multiple shock impacts on food security","Nature Food","","4","8","10.1038/s43016-023-00825-7","Andrea AmparoreMark A. ConstasFilippo FossiJosselin GaunyNeil MarslandJohn Ulimwengu","2023","http://link.springer.com/article/10.1038/s43016-023-00825-7","Article"
"A survey on binary metaheuristic algorithms and their engineering applications","Artificial Intelligence Review","","56","7","10.1007/s10462-022-10328-9","Jeng-Shyang PanPei HuVáclav SnášelShu-Chuan Chu","2023","http://link.springer.com/article/10.1007/s10462-022-10328-9","Article"
"An FMEA model for risk assessment of university sustainability: using a combined ITARA with TOPSIS-AL approach based neutrosophic sets","Annals of Operations Research","","","","10.1007/s10479-023-05250-4","Sheng-Wei LinHuai-Wei Lo","2023","http://link.springer.com/article/10.1007/s10479-023-05250-4","Article"
"A user-guided personalization methodology to facilitate new smart home occupancy","Universal Access in the Information Society","","22","3","10.1007/s10209-022-00883-x","S. M. Murad AliJuan Carlos AugustoDavid WindridgeEmma Ward","2023","http://link.springer.com/article/10.1007/s10209-022-00883-x","Article"
"Corporate social responsibility communication in the ICT sector: digital issues, greenwashing, and materiality","International Journal of Corporate Social Responsibility","","8","1","10.1186/s40991-023-00082-8","Jordan Famularo","2023","http://link.springer.com/article/10.1186/s40991-023-00082-8","Article"
"Two-dimensional materials-based integrated hardware","Science China Information Sciences","","66","6","10.1007/s11432-023-3744-2","Zhuiri PengRunfeng LinZheng LiLanglang XuXiangxiang YuXinyu HuangWenhao ShiXiao HeXiaohan MengLei TongXiangshui MiaoLei Ye","2023","http://link.springer.com/article/10.1007/s11432-023-3744-2","Article"
"Digital transformation for a circular economy: insights from co-word analysis","The Journal of Technology Transfer","","","","10.1007/s10961-023-10041-x","Isabel Soriano-PinarEloísa Díaz-GarridoSara Bermejo-Olivas","2023","http://link.springer.com/article/10.1007/s10961-023-10041-x","Article"
"Future urban transport management","Frontiers of Engineering Management","","10","3","10.1007/s42524-023-0255-3","Ziyou GaoHai-jun HuangJifu GuoLixing YangJianjun Wu","2023","http://link.springer.com/article/10.1007/s42524-023-0255-3","Article"
"Sustainable successes in third-party food delivery operations in the digital platform era","Annals of Operations Research","","","","10.1007/s10479-023-05266-w","Hau-Ling ChanTing-Ting CheungTsan-Ming ChoiJiuh-Biing Sheu","2023","http://link.springer.com/article/10.1007/s10479-023-05266-w","Article"
"Utilisation of Health Technologies for Physical Health of People with Learning Disabilities: Point of Care Testing","Journal of Psychosocial Rehabilitation and Mental Health","","","","10.1007/s40737-023-00362-3","Dolly SudArchana AnandaramHelen AtkinsRobyn McAskillSion Scott","2023","http://link.springer.com/article/10.1007/s40737-023-00362-3","Article"
"The impact of eHealth on relationships and trust in primary care: a review of reviews","BMC Primary Care","","24","1","10.1186/s12875-023-02176-5","Meena RamachandranChristopher BrintonDavid WiljerRoss UpshurCarolyn Steele Gray","2023","http://link.springer.com/article/10.1186/s12875-023-02176-5","Article"
"2022 CGA-IGC Annual Meeting: The collaborative group of the Americas on Inherited Gastrointestinal Cancer November 11–13, 2022","Familial Cancer","","22","2","10.1007/s10689-022-00324-x","","2023","http://link.springer.com/article/10.1007/s10689-022-00324-x","Article"
"Are Schumpeter’s Innovations Responsible? A Reflection on the Concept of Responsible (Research and) Innovation from a Neo-Schumpeterian Perspective","Journal of the Knowledge Economy","","","","10.1007/s13132-023-01487-3","K. ŚledzikA. Szmelter-JaroszE. Kalpazidou SchmidtK. BielawskiA. Declich","2023","http://link.springer.com/article/10.1007/s13132-023-01487-3","Article"
"Impact of ESG on firm value: a conceptual review of the literature","Journal of Social and Economic Development","","","","10.1007/s40847-023-00267-8","Radhika NarulaPurnima RaoAkshat Aditya Rao","2023","http://link.springer.com/article/10.1007/s40847-023-00267-8","Article"
"Clinical practice guidelines for the management of recurrent head and neck cancer: a systematic review and quality appraisal","European Archives of Oto-Rhino-Laryngology","","280","1","10.1007/s00405-022-07519-z","Emma De RavinJoseph LuMandy SalmonSanjena VenkateshDominic RomeoAlvaro MoreiraKarthik Rajasekaran","2023","http://link.springer.com/article/10.1007/s00405-022-07519-z","Article"
"Strengthening Prevention Systems to Address the Overdose Crisis Through the HEAL Prevention Cooperative and HEAL Preventing Opioid Use Disorder Research Program","Prevention Science","","","","10.1007/s11121-023-01579-1","Jeffrey A. CoadyNelia C. Nadal","2023","http://link.springer.com/article/10.1007/s11121-023-01579-1","Article"
"Research in the greenwashing field: concepts, theories, and potential impacts on economic and social value","Journal of Management and Governance","","","","10.1007/s10997-023-09686-5","Francesca BerniniFabio La Rosa","2023","http://link.springer.com/article/10.1007/s10997-023-09686-5","Article"
"Modeling the nexus of data analytics, sustainability practices and quality management: Evidence of key enablers","Environment, Development and Sustainability","","","","10.1007/s10668-023-03881-y","Sayem AhmedTazim AhmedHumaira Nafisa AhmedSyed Mithun AliErnesto D. R. Santibanez GonzalezGolam Kabir","2023","http://link.springer.com/article/10.1007/s10668-023-03881-y","Article"
"Emerging technological innovation in Gaza Strip municipalities: an entrepreneurial approach","Journal of Innovation and Entrepreneurship","","12","1","10.1186/s13731-023-00293-0","Ashraf Y. AlAstal","2023","http://link.springer.com/article/10.1186/s13731-023-00293-0","Article"
"Sustainable transition of the Republic of Serbia: measuring capacity for circularity in agriculture and rural areas","Energy, Sustainability and Society","","13","1","10.1186/s13705-023-00413-4","Igor VukelićSrđan MiloševićDiona ĐurđevićGordana RacićVilmoš Tot","2023","http://link.springer.com/article/10.1186/s13705-023-00413-4","Article"
"Data saves lives: optimising routinely collected clinical data for rare disease research","Orphanet Journal of Rare Diseases","","18","1","10.1186/s13023-023-02912-1","Ameenat Lola SoleboPirro HysiLisanne Andra Horvat-GitselsJugnoo Sangeeta Rahi","2023","http://link.springer.com/article/10.1186/s13023-023-02912-1","Article"
"Undue Influence or Exploitation — A Qualitative Inquiry into an Ethical Dilemma Around Payment in Crowd Work-Based Research in the U.S.","Computer Supported Cooperative Work (CSCW)","","","","10.1007/s10606-023-09472-9","Huichuan Xia","2023","http://link.springer.com/article/10.1007/s10606-023-09472-9","Article"
"Achieving Food Supply Chain Resilience During Natural Disasters Through Industry 5.0 Enablers—Empirical Insights Based on an FsQCA Approach","Information Systems Frontiers","","","","10.1007/s10796-023-10439-w","Subhadeep MandalArpan Kumar KarShivam GuptaUthayasankar Sivarajah","2023","http://link.springer.com/article/10.1007/s10796-023-10439-w","Article"
"Towards Industry 5.0 Challenges for The Textile and Apparel Supply Chain for The Smart, Sustainable, and Collaborative Industry in Emerging Economies","Information Systems Frontiers","","","","10.1007/s10796-023-10430-5","Yigit KazancogluSachin Kumar ManglaYalcin BerberogluCisem LafciJitender Madaan","2023","http://link.springer.com/article/10.1007/s10796-023-10430-5","Article"
"Sustainable international business model innovations for a globalizing circular economy: a review and synthesis, integrative framework, and opportunities for future research","Journal of International Business Studies","","","","10.1057/s41267-023-00652-9","Brian R. ChabowskiPeter GabrielssonG. Tomas M. HultForrest V. Morgeson III","2023","http://link.springer.com/article/10.1057/s41267-023-00652-9","Article"
"Voice Over Body? Older Adults’ Reactions to Robot and Voice Assistant Facilitators of Group Conversation","International Journal of Social Robotics","","15","2","10.1007/s12369-022-00925-7","Katie SeabornTakuya SekiguchiSeiki TokunagaNorihisa P. MiyakeMihoko Otake-Matsuura","2023","http://link.springer.com/article/10.1007/s12369-022-00925-7","Article"
"13th International Conference on Frailty & Sarcopenia Research (ICFSR)","The Journal of Frailty & Aging","","12","1","10.14283/jfa.2023.16","","2023","http://link.springer.com/article/10.14283/jfa.2023.16","Article"
"Mobile Mental Health Applications for American Indian and Alaska Native Communities: Review and Recommendations","Journal of Technology in Behavioral Science","","","","10.1007/s41347-023-00348-9","Alexandra B. CaloudasKristen E. FrosioJohn TorousCynthia W. GossDouglas K. NovinsJan A. LindsayJay H. Shore","2023","http://link.springer.com/article/10.1007/s41347-023-00348-9","Article"
"Theorizing ‘The Gap’ Twenty Years Later: Global Development, Design, and Speculative Ethics in Edtech Research","Postdigital Science and Education","","","","10.1007/s42438-023-00429-1","Jade Vu Henry","2023","http://link.springer.com/article/10.1007/s42438-023-00429-1","Article"
"Small businesses and FinTech: a systematic review and future directions","Electronic Commerce Research","","","","10.1007/s10660-023-09705-5","Sachin Kumar SharmaP. Vigneswara IlavarasanStan Karanasios","2023","http://link.springer.com/article/10.1007/s10660-023-09705-5","Article"
"Negotiating Your Way Through the Vigilance Agreement Maze—is There a Better Way?","Therapeutic Innovation & Regulatory Science","","57","5","10.1007/s43441-023-00513-5","Catherine Corbel-EcalardJean Kilgour-ChristieWeronika TrunDavid J. Lewis","2023","http://link.springer.com/article/10.1007/s43441-023-00513-5","Article"
"Lean production philosophy and sustainability approach: the fourth industrial phase","Production Engineering","","","","10.1007/s11740-023-01229-z","Adedugba AdebayoInegbedion DanielOreagba Oluwakemi","2023","http://link.springer.com/article/10.1007/s11740-023-01229-z","Article"
"Design of intelligent manufacturing IoT sensing system for polymer process monitoring","The International Journal of Advanced Manufacturing Technology","","","","10.1007/s00170-023-12510-x","Zhi-Hao WangYi-Ting LiYu-Chan Wu","2023","http://link.springer.com/article/10.1007/s00170-023-12510-x","Article"
"Digitale Souveränität in soziotechnischen Systemen – KI-Nutzung und Krisenbewältigung","Gruppe. Interaktion. Organisation. Zeitschrift für Angewandte Organisationspsychologie (GIO)","","54","1","10.1007/s11612-023-00674-9","Dr. Annelie HofmannDr. Ernst A. HartmannDr. Alexandra Shajek","2023","http://link.springer.com/article/10.1007/s11612-023-00674-9","Article"
"Research-ready data: the C-Surv data model","European Journal of Epidemiology","","38","2","10.1007/s10654-022-00916-y","Sarah BauermeisterJoshua R BauermeisterRuth BridgmanCaterina FeliciMark NewburyLaura NorthChristopher OrtonEmma SquiresSimon ThompsonSimon YoungJohn E Gallacher","2023","http://link.springer.com/article/10.1007/s10654-022-00916-y","Article"
"Diverse stakeholders and their interests matter to the U.S. Forest Service: a network of action situations analysis of how stakeholders affect forest plan outcomes","Sustainability Science","","18","1","10.1007/s11625-022-01173-4","Elizabeth BaldwinDanielle M. McLaughlinVincent JassoDavid WoodsDavid D. BreshearsLaura López-HoffmanJosé R. SotoAbigail SwannAaron Lien","2023","http://link.springer.com/article/10.1007/s11625-022-01173-4","Article"
"What do Older Adults Want from Social Robots? A Qualitative Research Approach to Human-Robot Interaction (HRI) Studies","International Journal of Social Robotics","","15","3","10.1007/s12369-022-00914-w","Roger Andre SøraaGunhild TøndelMark W. KharasJ Artur Serrano","2023","http://link.springer.com/article/10.1007/s12369-022-00914-w","Article"
"Using immersive technologies to facilitate location scouting in audiovisual media production: a user requirements study and proposed framework","Multimedia Tools and Applications","","82","8","10.1007/s11042-022-13680-8","Aimone BodiniFederico ColecchiaArthi ManoharDavid HarrisonVanja Garaj","2023","http://link.springer.com/article/10.1007/s11042-022-13680-8","Article"
"Analytical model to measure the effectiveness of content marketing on Twitter: the case of governorates in Colombia","Journal of Marketing Analytics","","","","10.1057/s41270-023-00243-5","Anabel Guzmán OrdóñezFrancisco Javier Arroyo CañadaEmmanuel LassoJavier A. Sánchez-TorresManuela Escobar-Sierra","2023","http://link.springer.com/article/10.1057/s41270-023-00243-5","Article"
"Web pages from mockup design based on convolutional neural network and class activation mapping","Multimedia Tools and Applications","","82","25","10.1007/s11042-023-15108-3","André Armstrong Janino CizottoRodrigo Clemente Thom de SouzaViviana Cocco MarianiLeandro dos Santos Coelho","2023","http://link.springer.com/article/10.1007/s11042-023-15108-3","Article"
"Introduction to the special issue: “Performance, management and governance in the digital age”","Journal of Management and Governance","","27","3","10.1007/s10997-023-09684-7","Hanne NørreklitLino Cinquini","2023","http://link.springer.com/article/10.1007/s10997-023-09684-7","Article"
"A cluster-randomized, placebo-controlled trial to evaluate the efficacy of a spatial repellent (Mosquito Shield™) against Aedes-borne virus infection among children ≥ 4–16 years of age in the Gampaha District, Sri Lanka: study protocol (the AEGIS program)","Trials","","24","1","10.1186/s13063-022-06998-z","Hasitha TisseraD. S. Anoja F. DheerasingheNeelika MalavigeH. Asita de SilvaAmy C. MorrisonThomas W. ScottRobert C. Reiner JrJohn P. GriecoNicole L. Achee","2023","http://link.springer.com/article/10.1186/s13063-022-06998-z","Article"
"Keratoconus International Consortium (KIC)- advancing keratoconus research","BMC Ophthalmology","","23","1","10.1186/s12886-023-03087-w","Srujana SahebjadaElsie ChanGerard SuttonChi Pui Calvin PangYves KerdraonSundaram NatarajanWafaa MeteoukkiAndrea AngMark DaniellPaul N. Baird","2023","http://link.springer.com/article/10.1186/s12886-023-03087-w","Article"
"An Intelligent Support System to Help Teachers Plan Field Trips","International Journal of Artificial Intelligence in Education","","","","10.1007/s40593-023-00366-x","Noemi MauroLiliana ArdissonoFederica CenaLivio ScarpinatiGianluca Torta","2023","http://link.springer.com/article/10.1007/s40593-023-00366-x","Article"
"Career experts’ conceptions of innovation in career development","International Journal for Educational and Vocational Guidance","","23","2","10.1007/s10775-021-09509-9","Jaana Kettunen","2023","http://link.springer.com/article/10.1007/s10775-021-09509-9","Article"
"Moving from measurement to governance of shared groundwater resources","Nature Water","","1","1","10.1038/s44221-022-00008-x","Meagan E. SchipanskiMatthew R. SandersonLinda Estelí Méndez-BarrientosAmy KremenPrasanna GowdaDana PorterKevin WagnerCharles WestCharles W. RiceMark MarsalisBridget GuerreroErin HaackerJames DobrowolskiChittaranjan RayBrent Auvermann","2023","http://link.springer.com/article/10.1038/s44221-022-00008-x","Article"
"A Systematic Review of Methodological Tools for Evaluating the Water, Energy, Food, and One Health Nexus in Transboundary Water Basins","Environmental Management","","72","3","10.1007/s00267-023-01841-w","Constance BwireGeetha MohanDaniel KartheSerena CaucciJian Pu","2023","http://link.springer.com/article/10.1007/s00267-023-01841-w","Article"
"Integrating X-reality and lean into end-of-life aircraft parts disassembly sequence planning: a critical review and research agenda","The International Journal of Advanced Manufacturing Technology","","127","5 - 6","10.1007/s00170-023-11581-0","Yinong YangSamira KeivanpourDaniel Imbeau","2023","http://link.springer.com/article/10.1007/s00170-023-11581-0","Article"
"End-of-life vehicles research development in Malaysia: a comprehensive review with the integrated conceptual model of innovative sustainable manufacturing elements","Journal of Material Cycles and Waste Management","","25","2","10.1007/s10163-022-01568-6","Jia Yuik ChongMuhamad Zameri Mat SamanNor Hasrul Akhmal Ngadiman","2023","http://link.springer.com/article/10.1007/s10163-022-01568-6","Article"
"Incumbents’ Capabilities for Sustainability-Oriented Innovation in the Norwegian Food Sector—an Integrated Framework","Circular Economy and Sustainability","","3","3","10.1007/s43615-022-00234-1","Antje GoneraHilde Andrea NykampLaura Carraresi","2023","http://link.springer.com/article/10.1007/s43615-022-00234-1","Article"
"Negotiating Priorities on the Shopfloor: A Design Case Study of Maintainers’ Practices","Computer Supported Cooperative Work (CSCW)","","32","1","10.1007/s10606-022-09444-5","Christoph KotthausNico VittMax KrügerVolkmar PipekVolker Wulf","2023","http://link.springer.com/article/10.1007/s10606-022-09444-5","Article"
"Ethics and Robot Democratization: Reflecting on Integrative Ethics Practices","International Journal of Social Robotics","","","","10.1007/s12369-023-01005-0","Jesse de Pagter","2023","http://link.springer.com/article/10.1007/s12369-023-01005-0","Article"
"One-to-one marketing management via customer complaint","Social Network Analysis and Mining","","13","1","10.1007/s13278-023-01082-z","Shawanluck KunathikornkitIntaka PiriyakulRapepun Piriyakul","2023","http://link.springer.com/article/10.1007/s13278-023-01082-z","Article"
"A systematic review for assessing the impact of climate change on landslides: research gaps and directions for future research","Spatial Information Research","","","","10.1007/s41324-023-00551-z","Aastha SharmaHaroon SajjadRoshaniMd Hibjur Rahaman","2023","http://link.springer.com/article/10.1007/s41324-023-00551-z","Article"
