Item Title,Publication Title,Book Series Title,Journal Volume,Journal Issue,Item DOI,Authors,Publication Year,URL,Content Type
"Reporting the early stage clinical evaluation of virtual-reality-based intervention trials: RATE-VR","Nature Medicine","","29","1","10.1038/s41591-022-02085-7","Johan H. VlakeJasper van BommelGiuseppe RivaBrenda K. WiederholdPietro CipressoAlbert Skip RizzoCristina BotellaLotty HooftO. Joseph BienvenuBart GeertsEvert-Jan WilsDiederik GommersMichel E. van Genderen","2023","http://link.springer.com/article/10.1038/s41591-022-02085-7","Article"
"Conceptualization and development of an autonomous and personalized early literacy content and robot tutor behavior for preschool children","User Modeling and User-Adapted Interaction","","33","2","10.1007/s11257-022-09344-9","Ohoud AlmousaSharifa Alghowinem","2023","http://link.springer.com/article/10.1007/s11257-022-09344-9","Article"
"Understanding the intertwined nature of rising multiple risks in modern agriculture and food system","Environment, Development and Sustainability","","","","10.1007/s10668-023-03638-7","Priti KhatriPrashant KumarKaushlesh Singh ShakyaMarios C. KirlasKamal Kant Tiwari","2023","http://link.springer.com/article/10.1007/s10668-023-03638-7","Article"
"BIM-based Clash Resolution Process Using Fuzzy AHP Methods","Iranian Journal of Science and Technology, Transactions of Civil Engineering","","","","10.1007/s40996-023-01238-z","Ali HasannejadAli Akbar Shirzadi JavidIman Bitaraf","2023","http://link.springer.com/article/10.1007/s40996-023-01238-z","Article"
"Applying and Assessing Participatory Approaches in an Environmental Flows Case Study","Environmental Management","","72","4","10.1007/s00267-023-01829-6","Meghan MussehlJ. Angus WebbAvril HorneLibby RumpffLeRoy Poff","2023","http://link.springer.com/article/10.1007/s00267-023-01829-6","Article"
"Understanding design education with a bibliometric approach: a story of 50 years","Research in Engineering Design","","","","10.1007/s00163-023-00425-3","İbrahim DelenFatma ÖzüdoğruKadir DemirAyse BuberYasemin Kahyaoglu ErdogmusElif Bugra Kuzu DemirGul Unal CobanErcan Akpinar","2023","http://link.springer.com/article/10.1007/s00163-023-00425-3","Article"
"Envisioning the future of virtual production in filmmaking: A remote co-design study","Multimedia Tools and Applications","","","","10.1007/s11042-023-16308-7","Aimone BodiniArthi ManoharFederico ColecchiaDavid HarrisonVanja Garaj","2023","http://link.springer.com/article/10.1007/s11042-023-16308-7","Article"
"Faculty development for translational simulation: a qualitative study of current practice","Advances in Simulation","","8","1","10.1186/s41077-023-00265-0","Victoria BrazilEve PurdyAlexander El KheirRebecca A. Szabo","2023","http://link.springer.com/article/10.1186/s41077-023-00265-0","Article"
"Reengineering neurotechnology: placing patients first","Nature Mental Health","","1","1","10.1038/s44220-022-00011-x","Markus PlonerAlena BuyxJens GemptJulijana GjorgjievaRuth MüllerJosef PrillerDaniel RückertBernhard WolfrumSimon N. Jacob","2023","http://link.springer.com/article/10.1038/s44220-022-00011-x","Article"
"Organizational Agility and Communicative Actions for Responsible Innovation: Evidence from manufacturing firms in South Korea","Asia Pacific Journal of Management","","","","10.1007/s10490-023-09883-8","Hongryol ChaSung-Min Park","2023","http://link.springer.com/article/10.1007/s10490-023-09883-8","Article"
"Assessing the impact of blockchain technology on the overall performance of sustainable supply chains: an analytical perspective","Environmental Science and Pollution Research","","","","10.1007/s11356-023-30366-2","Md SahabuddinQingmei TanMaryam KhokharMohammad Amzad HossainMohammad Faridul AlamWahiduzzaman Khan","2023","http://link.springer.com/article/10.1007/s11356-023-30366-2","Article"
"A circular waste bioeconomy development model in the Ecuadorian fishery industry: the impact of government strategy on supply chain integration and smart operations","Environmental Science and Pollution Research","","30","43","10.1007/s11356-023-29333-8","Yeneneh Tamirat NegashLiria Salome Calahorrano SarmientoShuan-Wei TsengMing K. LimMing-Lang Tseng","2023","http://link.springer.com/article/10.1007/s11356-023-29333-8","Article"
"Robots among us: ordinary but significant human–robot interactions in the city","AI & SOCIETY","","","","10.1007/s00146-023-01647-8","Jeffrey Kok Hui ChanYixiao Wang","2023","http://link.springer.com/article/10.1007/s00146-023-01647-8","Article"
"Designing innovative digital platforms from both human and nonhuman perspectives","Multimedia Tools and Applications","","82","26","10.1007/s11042-023-15124-3","Risa KimuraTatsuo Nakajima","2023","http://link.springer.com/article/10.1007/s11042-023-15124-3","Article"
"Cheer for me: effect of non-player character audience feedback on older adult users of virtual reality exergames","Virtual Reality","","27","3","10.1007/s10055-023-00780-5","Kangyou YuShaoyue WenWenge XuMaurizio CaonNilufar BaghaeiHai-Ning Liang","2023","http://link.springer.com/article/10.1007/s10055-023-00780-5","Article"
"Overcoming barriers to transformation in manufacturing firms. A path-dependence perspective of digital servitization","Review of Managerial Science","","","","10.1007/s11846-023-00641-0","Thomas BrekkeSambit LenkaMarko KohtamäkiVinit ParidaBirgit Andrine Apenes Solem","2023","http://link.springer.com/article/10.1007/s11846-023-00641-0","Article"
"Prioritization of e-traceability drivers in the agri-food supply chains","Agricultural and Food Economics","","11","1","10.1186/s40100-023-00284-5","Mladen KrstićGiulio Paolo AgnusdeiSnežana TadićPier Paolo Miglietta","2023","http://link.springer.com/article/10.1186/s40100-023-00284-5","Article"
"Culinary Nutrition Education Programs in Community-Dwelling Older Adults: A Scoping Review","The journal of nutrition, health & aging","","27","2","10.1007/s12603-022-1876-7","Maryam M. AlghamdiT. BurrowsB. BarclayS. BainesC. Chojenta","2023","http://link.springer.com/article/10.1007/s12603-022-1876-7","Article"
"Lessons Learned from Online Learning at Scale: a Study of Exemplar Learning Organizations","TechTrends","","67","1","10.1007/s11528-022-00761-6","Siyuan LiScotty D. CraigNoah L. Schroeder","2023","http://link.springer.com/article/10.1007/s11528-022-00761-6","Article"
"A lighthouse to enhance the quality of life in the Nile River basin","Environmental Economics and Policy Studies","","","","10.1007/s10018-023-00380-2","Ayman Batisha","2023","http://link.springer.com/article/10.1007/s10018-023-00380-2","Article"
"Groundwater nitrate problem and countermeasures in strongly affected EU countries—a comparison between Germany, Denmark and Ireland","Grundwasser","","28","1","10.1007/s00767-022-00530-5","Felix OrtmeyerBirgitte HansenAndre Banning","2023","http://link.springer.com/article/10.1007/s00767-022-00530-5","Article"
"Designing virtual reality tools for students with Autism Spectrum Disorder: A systematic review","Education and Information Technologies","","28","8","10.1007/s10639-022-11545-z","Gonzalo G. LorenzoNigel N. NewbuttAlejandro A. Lorenzo-Lledó","2023","http://link.springer.com/article/10.1007/s10639-022-11545-z","Article"
"Implementation Science and Practice-Oriented Research: Convergence and Complementarity","Administration and Policy in Mental Health and Mental Health Services Research","","","","10.1007/s10488-023-01296-5","Soo Jeong YounJames F. BoswellSusan DouglasBethany A. HarrisSyed AajmainKimberly T. ArnoldTorrey A. CreedCassidy A. GutnerRosaura Orengo-AguayoJennifer M. OswaldShannon Wiltsey Stirman","2023","http://link.springer.com/article/10.1007/s10488-023-01296-5","Article"
"Facilitating innovation in FinTech: a review and research agenda","Review of Managerial Science","","17","1","10.1007/s11846-022-00531-x","Ahmad AlaassarAnne-Laure MentionTor Helge Aas","2023","http://link.springer.com/article/10.1007/s11846-022-00531-x","Article"
"A Pesticide Decision Support Tool to guide the selection of less environmentally harmful pesticides for the sugar cane industry","Environmental Science and Pollution Research","","30","49","10.1007/s11356-023-29814-w","Michael St. John WarnePeta A. NealeMichael J. Macpherson","2023","http://link.springer.com/article/10.1007/s11356-023-29814-w","Article"
"Why do we need to care about transboundary aquifers and how do we solve their issues?","Hydrogeology Journal","","31","1","10.1007/s10040-022-02552-y","Alfonso RiveraMarie-Amélie PétréChristina FraserJacob D. Petersen-PerlmanRosario SanchezLaura MovillaKevin Pietersen","2023","http://link.springer.com/article/10.1007/s10040-022-02552-y","Article"
"Assessing evidence on the impacts of nature-based interventions for climate change mitigation: a systematic map of primary and secondary research from subtropical and tropical terrestrial regions","Environmental Evidence","","12","1","10.1186/s13750-023-00312-3","Samantha H. ChengSebastien CostedoatAmanda SigouinGabriel F. CalistroCatherine J. ChamberlainPeter LichtenthalMorena MillsA. Justin NowakowskiEleanor J. SterlingJen TinsmanMeredith WigginsPedro H. S. BrancalionSteven W. J. CantyAllison Fritts-PennimanArundhati JagadishKelly Jones","2023","http://link.springer.com/article/10.1186/s13750-023-00312-3","Article"
"Design thinking as an effective method for problem-setting and needfinding for entrepreneurial teams addressing wicked problems","Journal of Innovation and Entrepreneurship","","12","1","10.1186/s13731-023-00291-2","Rahmin Bender-Salazar","2023","http://link.springer.com/article/10.1186/s13731-023-00291-2","Article"
"Visual Analytics: Transferring, Translating and Transforming Knowledge from Analytics Experts to Non-technical Domain Experts in Multidisciplinary Teams","Information Systems Frontiers","","25","4","10.1007/s10796-022-10310-4","Olivera MarjanovicGreg PatmoreNikola Balnave","2023","http://link.springer.com/article/10.1007/s10796-022-10310-4","Article"
"bTB eradication in Ireland: where to from here?","Irish Veterinary Journal","","76","1","10.1186/s13620-023-00239-8","Simon J. More","2023","http://link.springer.com/article/10.1186/s13620-023-00239-8","Article"
"Equity-Oriented Learning Design: An Entangled Future","Postdigital Science and Education","","","","10.1007/s42438-023-00420-w","Daniela GachagoMaha BaliNicola Pallitt","2023","http://link.springer.com/article/10.1007/s42438-023-00420-w","Article"
"Smart port: a systematic literature review","European Transport Research Review","","15","1","10.1186/s12544-023-00581-6","Basma BelmoukariJean-François AudyPascal Forget","2023","http://link.springer.com/article/10.1186/s12544-023-00581-6","Article"
"New actors and new learning spaces for new times: a framework for schooling that extends beyond the school","Learning Environments Research","","26","1","10.1007/s10984-022-09432-y","Cornelia ConnollyCliona MurrayBernadine BradyGerry Mac RuaircPat Dolan","2023","http://link.springer.com/article/10.1007/s10984-022-09432-y","Article"
"Do adaptive policy adjustments deliver ecosystem-agriculture-economy co-benefits in land degradation neutrality efforts? Evidence from southeast coast of China","Environmental Monitoring and Assessment","","195","10","10.1007/s10661-023-11821-6","Chong JiangYixin WangZhiyuan YangYing Zhao","2023","http://link.springer.com/article/10.1007/s10661-023-11821-6","Article"
"Ecomodernism and the Libidinal Economy: Towards a Critical Conception of Technology in the Bio-Based Economy","Philosophy & Technology","","36","2","10.1007/s13347-023-00617-8","Roel VeraartVincent BlokPieter Lemmens","2023","http://link.springer.com/article/10.1007/s13347-023-00617-8","Article"
"A systematic literature review of requirements engineering education","Requirements Engineering","","28","2","10.1007/s00766-022-00381-9","Marian DaunAlicia M. GrubbViktoria StenkovaBastian Tenbergen","2023","http://link.springer.com/article/10.1007/s00766-022-00381-9","Article"
"Adopting an Ecosystem Approach to Digitalization-driven Organizational Change ?  Actionable Knowledge from a Collaborative Project","Systemic Practice and Action Research","","","","10.1007/s11213-023-09632-4","Emanuela ShabaMarco GuerciFilomena CanterinoSilvia GilardiRaffaella CaglianoEmilio Bartezzaghi","2023","http://link.springer.com/article/10.1007/s11213-023-09632-4","Article"
"Home-based upper limb stroke rehabilitation mechatronics: challenges and opportunities","BioMedical Engineering OnLine","","22","1","10.1186/s12938-023-01133-8","Shane ForbriggerVincent G. DePaulT. Claire DaviesEvelyn MorinKeyvan Hashtrudi-Zaad","2023","http://link.springer.com/article/10.1186/s12938-023-01133-8","Article"
"Interventions for Indigenous Peoples making health decisions: a systematic review","Archives of Public Health","","81","1","10.1186/s13690-023-01177-1","Janet JullKimberly FairmanSandy OliverBrittany HesmerAbdul Kareem Pullattayil","2023","http://link.springer.com/article/10.1186/s13690-023-01177-1","Article"
"Strategic Objectives for Aligning Healthcare and IT Practices in Providing Integrated Care for Multimorbid Patients: A Soft Systems Methodology Perspective","Systemic Practice and Action Research","","","","10.1007/s11213-023-09643-1","Agnes NakakawaEsteban de Manuel KeenoyAne Fullaondo ZabalaDolores Verdoy BerasteguiJon Txarramendieta Suarez","2023","http://link.springer.com/article/10.1007/s11213-023-09643-1","Article"
"Weather data-centric prediction of maize non-stressed canopy temperature in semi-arid climates for irrigation management","Irrigation Science","","","","10.1007/s00271-023-00863-w","Hope Njuki NakabuyeDaran R. RudnickKendall C. DeJongeKatherine AscoughWei-zhen LiangTsz Him LoTrenton E. FranzXin QiaoAbia KatimboJiaming Duan","2023","http://link.springer.com/article/10.1007/s00271-023-00863-w","Article"
"Biomedical Specialized Masters Programs: What are They and How do They Meet the Needs of Employers?","Biomedical Engineering Education","","3","2","10.1007/s43683-023-00115-5","Sabriya StukesEliot BethkeMichael J. O’DonnellJennifer R. Amos","2023","http://link.springer.com/article/10.1007/s43683-023-00115-5","Article"
"Emerging industry 4.0 and Internet of Things (IoT) technologies in the Ghanaian construction industry: sustainability, implementation challenges, and benefits","Environmental Science and Pollution Research","","30","13","10.1007/s11356-022-24764-1","Rashid MaqboolMohammed Rayan SaibaSaleha Ashfaq","2023","http://link.springer.com/article/10.1007/s11356-022-24764-1","Article"
"A Technology-Organization-Environment (TOE) Framework Based on Scientometry for Understanding The Risk Factors in Sustainable Water Resources Management","Water Resources Management","","","","10.1007/s11269-023-03634-6","Chih-Hsien LinWei-Hsiang Chen","2023","http://link.springer.com/article/10.1007/s11269-023-03634-6","Article"
"From Sustainability to Regeneration: a digital framework with BIM and computational design methods","Architecture, Structures and Construction","","3","3","10.1007/s44150-023-00094-9","Arlind Dervishaj","2023","http://link.springer.com/article/10.1007/s44150-023-00094-9","Article"
"eHealth usage among parents to premature or surgically treated neonates: associations with eHealth literacy, healthcare satisfaction or satisfaction with an eHealth device","BMC Pediatrics","","23","1","10.1186/s12887-023-04340-3","Mariette DerwigRose-Marie LindkvistInger Kristensson HallströmBjörn A. JohnssonPernilla Stenström","2023","http://link.springer.com/article/10.1186/s12887-023-04340-3","Article"
"Environmental Sustainability in the Age of Big Data: Opportunities and Challenges for Business and Industry","Environmental Science and Pollution Research","","","","10.1007/s11356-023-30301-5","Chuang LiMinghao Huang","2023","http://link.springer.com/article/10.1007/s11356-023-30301-5","Article"
"Linking sustainability and the Fourth Industrial Revolution: a monitoring framework accounting for technological development","Energy, Sustainability and Society","","13","1","10.1186/s13705-023-00405-4","Florian SiekmannHolger SchlörSandra Venghaus","2023","http://link.springer.com/article/10.1186/s13705-023-00405-4","Article"
"Evidence on the efficacy of small unoccupied aircraft systems (UAS) as a survey tool for North American terrestrial, vertebrate animals: a systematic map","Environmental Evidence","","12","1","10.1186/s13750-022-00294-8","Jared A. ElmoreEmma A. SchultzLandon R. JonesKristine O. EvansSathishkumar SamiappanMorgan B. PfeifferBradley F. BlackwellRaymond B. Iglay","2023","http://link.springer.com/article/10.1186/s13750-022-00294-8","Article"
"14th Meeting of the International Academy of Health Preference Research","The Patient - Patient-Centered Outcomes Research","","16","4","10.1007/s40271-023-00636-9","","2023","http://link.springer.com/article/10.1007/s40271-023-00636-9","Article"
"Habitat assessment for threatened species in the cross-border region of the Atlantic Forest","Landscape Ecology","","38","9","10.1007/s10980-023-01689-9","Milena Fiuza DinizMaría José Andrade-NúñezFrancisco DallmeierAna María Sánchez-Cuervo","2023","http://link.springer.com/article/10.1007/s10980-023-01689-9","Article"
"Cross-cultural ranking of cellphone life cycle issues for strategic CSR marketing with social media-based AHP","Environment, Development and Sustainability","","","","10.1007/s10668-023-04009-y","Mohammad Amin DarziSadra AhmadiSajjad Shokouhyar","2023","http://link.springer.com/article/10.1007/s10668-023-04009-y","Article"
"What evidence exists on the performance of nature-based solutions interventions for coastal protection in biogenic, shallow ecosystems? A systematic map protocol","Environmental Evidence","","12","1","10.1186/s13750-023-00303-4","Avery B. PaxtonTrevor N. RileyCamille L. SteenrodCarter S. SmithY. Stacy ZhangRachel K. GittmanBrian R. SillimanChristine A. BuckelT. Shay ViehmanBrandon J. PuckettJenny Davis","2023","http://link.springer.com/article/10.1186/s13750-023-00303-4","Article"
"Adsorption Technology in the Sugar Industry: Current Status and Future Perspectives","Sugar Tech","","25","5","10.1007/s12355-023-01272-1","Kingsley O. IwuozorAdewale George AdeniyiEbuka Chizitere EmenikeBashir Oladapo OlaniyiValentine Ugochukwu AnyanwuJoy Oluwafemi BamigbolaHappiness Taiwo Ojo","2023","http://link.springer.com/article/10.1007/s12355-023-01272-1","Article"
"Dynamic interplay of environmental sustainability and corporate reputation: a combined parametric and nonparametric approach","Annals of Operations Research","","324","1 - 2","10.1007/s10479-021-04331-6","He-Boong KwonJooh LeeLaee Choi","2023","http://link.springer.com/article/10.1007/s10479-021-04331-6","Article"
"Marketing at UNSW Sydney: Building Marketing Capability in Australasia","Customer Needs and Solutions","","10","1","10.1007/s40547-023-00139-6","John H. RobertsMark UnclesHarald J. van HeerdeValentyna MelnykMaggie Chuoyan Dong","2023","http://link.springer.com/article/10.1007/s40547-023-00139-6","Article"
"Survey of wastewater issues due to oil spills and pollution in the Niger Delta area of Nigeria: a secondary data analysis","Bulletin of the National Research Centre","","47","1","10.1186/s42269-023-01090-1","Daniel Raphael Ejike EwimOchuko Felix OrikpeteTemiloluwa O. ScottChisom N. OnyebuchiAmanda O. OnukoguChinedum Gloria UzougboChiemela Onunka","2023","http://link.springer.com/article/10.1186/s42269-023-01090-1","Article"
"A user-based information rating scale to evaluate the design of technology-based supports for autism","Universal Access in the Information Society","","","","10.1007/s10209-023-00995-y","Vanessa ZervogianniSue Fletcher-WatsonGerardo HerreraMatthew S. GoodwinElise TriquellPatricia Pérez-FusterMark BrosnanOuriel Grynszpan","2023","http://link.springer.com/article/10.1007/s10209-023-00995-y","Article"
"Digital technology-enabled governance for sustainability in global value chains: a framework and future research agenda","Journal of Industrial and Business Economics","","50","1","10.1007/s40812-022-00249-7","Stephanie Lu Wang","2023","http://link.springer.com/article/10.1007/s40812-022-00249-7","Article"
"Analyzing vulnerability of communities to flood using composite vulnerability index: evidence from Bhagirathi Sub-basin, India","Natural Hazards","","","","10.1007/s11069-023-06170-z","Sufia RehmanMd. Hibjur RahamanMd. MasroorRoshaniHaroon SajjadRaihan AhmedAli P. YunusMehebub Sahana","2023","http://link.springer.com/article/10.1007/s11069-023-06170-z","Article"
"Cloud manufacturing adoption: a comprehensive review","Information Systems and e-Business Management","","","","10.1007/s10257-023-00638-y","Mahesh S. KavreVivek K. SunnapwarBhaskar B. Gardas","2023","http://link.springer.com/article/10.1007/s10257-023-00638-y","Article"
"Inclusive Immersion: a review of efforts to improve accessibility in virtual reality, augmented reality and the metaverse","Virtual Reality","","","","10.1007/s10055-023-00850-8","John DudleyLulu YinVanja GarajPer Ola Kristensson","2023","http://link.springer.com/article/10.1007/s10055-023-00850-8","Article"
"Is Convergence Around The Circular Economy Necessary? Exploring the Productivity of Divergence in US Circular Economy Discourse and Practice","Circular Economy and Sustainability","","3","3","10.1007/s43615-022-00199-1","Brieanne BerryJamie HaverkampCindy IsenhourMelissa M. BilecSara Sophia Lowden","2023","http://link.springer.com/article/10.1007/s43615-022-00199-1","Article"
"What kind of innovation state matters for social justice? Learning from Poulantzas and going beyond","Review of Evolutionary Political Economy","","4","2","10.1007/s43253-023-00099-6","Theo Papaioannou","2023","http://link.springer.com/article/10.1007/s43253-023-00099-6","Article"
"Towards the efficient generation of variant design in product development networks: network nodes importance based product configuration evaluation approach","Journal of Intelligent Manufacturing","","34","2","10.1007/s10845-021-01813-z","Yuming Guo","2023","http://link.springer.com/article/10.1007/s10845-021-01813-z","Article"
"Attention-based adaptive feature selection for multi-stage image dehazing","The Visual Computer","","39","2","10.1007/s00371-021-02365-2","Xiaoling LiZhen HuaJinjiang Li","2023","http://link.springer.com/article/10.1007/s00371-021-02365-2","Article"
"A deep dive into the impacts of empathy on design learning and teaching","International Journal of Technology and Design Education","","","","10.1007/s10798-023-09835-9","Pelin EfiltiKoray Gelmez","2023","http://link.springer.com/article/10.1007/s10798-023-09835-9","Article"
"ADELA: a conversational virtual assistant to prevent delirium in hospitalized older persons","The Journal of Supercomputing","","79","15","10.1007/s11227-023-05352-7","Javier Alonso-MencíaMarta Castro-RodríguezBeatriz Herrero-PinillaJuan M. Alonso-WeberLeocadio Rodríguez-MañasRodrigo Pérez-Rodríguez","2023","http://link.springer.com/article/10.1007/s11227-023-05352-7","Article"
"Digital Transformation Stands Alongside Inclusive Education: Lessons Learned from a Project Called “Waking Up in the Morning”","Technology, Knowledge and Learning","","","","10.1007/s10758-023-09667-5","Polyxeni Kaimara","2023","http://link.springer.com/article/10.1007/s10758-023-09667-5","Article"
"Towards data-driven tele-medicine intelligence: community-based mental healthcare paradigm shift for smart aging amid COVID-19 pandemic","Health Information Science and Systems","","11","1","10.1007/s13755-022-00198-4","Lan ChengWK ChanYi PengHarry Qin","2023","http://link.springer.com/article/10.1007/s13755-022-00198-4","Article"
"Evidence Summary for Prevention of Gastrointestinal Dysfunction After Laparoscopic Surgery","Indian Journal of Surgery","","85","2","10.1007/s12262-022-03429-w","Qi YuanXin DanLi Chen","2023","http://link.springer.com/article/10.1007/s12262-022-03429-w","Article"
"Development of an augmented reality remote maintenance adoption model through qualitative analysis of success factors","Operations Management Research","","16","3","10.1007/s12063-023-00356-1","Maike MüllerDirk StegelmeyerRakesh Mishra","2023","http://link.springer.com/article/10.1007/s12063-023-00356-1","Article"
"What information can we gain from the quality appraisal of guidelines with physical activity recommendations for cancer patients?A systematic review using the AGREE II and AGREE-REX tools","Supportive Care in Cancer","","31","1","10.1007/s00520-022-07567-5","Xue ZhouYujie YangConghui LiShanshan GuWeiqian HouXigui LaiLiwen ZhaiYi Zhu","2023","http://link.springer.com/article/10.1007/s00520-022-07567-5","Article"
"Clinical practice guideline recommendations for diagnosis and management of anxiety and depression in hospitalized adults with delirium: a systematic review","Systematic Reviews","","12","1","10.1186/s13643-023-02339-6","Therese G. PoulinNatalia JaworskaHenry T. StelfoxKirsten M. FiestStephana J. Moss","2023","http://link.springer.com/article/10.1186/s13643-023-02339-6","Article"
"Is social presence (alone) a general predictor for good remote collaboration? comparing video and augmented reality guidance in maintenance procedures","Virtual Reality","","27","3","10.1007/s10055-023-00770-7","Bernardo MarquesCarlos FerreiraSamuel SilvaPaulo DiasBeatriz Sousa Santos","2023","http://link.springer.com/article/10.1007/s10055-023-00770-7","Article"
"Blockchain in project management: a systematic review of use cases and a design decision framework","Journal of Ambient Intelligence and Humanized Computing","","14","7","10.1007/s12652-021-03610-1","Rifat SonmezFerda Özdemir SönmezSalar Ahmadisheykhsarmast","2023","http://link.springer.com/article/10.1007/s12652-021-03610-1","Article"
